"Rank","EntryId","EntryName","TimeRemaining","Points","Lineup","X","Player","Roster.Position","X.Drafted","FPTS"
1938,940304956,"pat.hendrickson.34 (2/3)",0,241.75,"SG Stephen Curry PG Kyle Lowry UTIL Klay Thompson PF Taj Gibson SF Evan Fournier C Willie Cauley-Stein G Michael Carter-Williams F Frank Kaminsky",NA,"","","",NA
1938,940309691,"pat.hendrickson.34 (3/3)",0,241.75,"SG Stephen Curry PG Kyle Lowry UTIL Klay Thompson PF Taj Gibson SF Evan Fournier C Willie Cauley-Stein G Michael Carter-Williams F Frank Kaminsky",NA,"","","",NA
1957,939404557,"chrisn671 (1/20)",0,241.5,"G Russell Westbrook C Karl-Anthony Towns SF Andrew Wiggins UTIL Denzel Valentine F Thaddeus Young PG Michael Carter-Williams PF Frank Kaminsky SG Alec Burks",NA,"","","",NA
1957,939427705,"leo55pico",0,241.5,"G Victor Oladipo SF DeMar DeRozan PF Carmelo Anthony SG Jrue Holiday C Pau Gasol PG Darren Collison F Taj Gibson UTIL Frank Mason III",NA,"","","",NA
1957,939430797,"eckoplatinum (1/20)",0,241.5,"PG Stephen Curry SF Kevin Durant C Draymond Green SG Klay Thompson UTIL Tyler Johnson PF JaMychal Green G Dillon Brooks F Marvin Williams",NA,"","","",NA
1957,939516610,"Jride1978 (1/5)",0,241.5,"SF Paul George PG Kyle Lowry PF Aaron Gordon SG Jimmy Butler G Dion Waiters C Taj Gibson F Thabo Sefolosha UTIL JaVale McGee",NA,"","","",NA
1957,939540346,"parec (2/3)",0,241.5,"C Karl-Anthony Towns PF LaMarcus Aldridge PG Kyle Lowry F Otto Porter SF Thaddeus Young SG Kelly Oubre Jr. UTIL Norman Powell G Tomas Satoransky",NA,"","","",NA
1957,939581727,"MMetzler",0,241.5,"PF LaMarcus Aldridge PG Kyle Lowry F Otto Porter SG Dion Waiters C Steven Adams SF Thaddeus Young UTIL Domantas Sabonis G Tomas Satoransky",NA,"","","",NA
1957,939610279,"Lunacy3 (13/20)",0,241.5,"C Anthony Davis SF Aaron Gordon SG Kris Dunn PF Lauri Markkanen F Pau Gasol PG Ricky Rubio UTIL Michael Carter-Williams G Alec Burks",NA,"","","",NA
1957,939610282,"Lunacy3 (16/20)",0,241.5,"F Anthony Davis SF Aaron Gordon G Kris Dunn PF Lauri Markkanen C Pau Gasol PG Ricky Rubio UTIL Michael Carter-Williams SG Alec Burks",NA,"","","",NA
1957,939760111,"joelrhone29",0,241.5,"SF Paul George F Draymond Green SG Tyreke Evans PF Carmelo Anthony UTIL Otto Porter PG Reggie Jackson C Zach Randolph G Tony Allen",NA,"","","",NA
1957,939814917,"Skadoosh (6/20)",0,241.5,"G Russell Westbrook C Andre Drummond SF Tobias Harris UTIL Ricky Rubio F Kyle Anderson PF Kelly Olynyk PG Michael Carter-Williams SG Alec Burks",NA,"","","",NA
1957,939993283,"mpaladini (1/3)",0,241.5,"PF LaMarcus Aldridge PG Kyle Lowry SG Jimmy Butler SF Otto Porter F Taj Gibson UTIL Kelly Oubre Jr. G Josh Richardson C Kelly Olynyk",NA,"","","",NA
1957,939993413,"mpaladini (2/3)",0,241.5,"PF LaMarcus Aldridge PG Kyle Lowry SG Jimmy Butler SF Otto Porter F Taj Gibson UTIL Kelly Oubre Jr. G Josh Richardson C Kelly Olynyk",NA,"","","",NA
1957,940252782,"SweetMelo7",0,241.5,"PF LaMarcus Aldridge SF DeMar DeRozan C Marc Gasol UTIL Justin Holiday SG Jeremy Lamb PG Ricky Rubio F Kelly Oubre Jr. G Tomas Satoransky",NA,"","","",NA
1957,940309800,"AHHELL",0,241.5,"SF DeMar DeRozan PF Draymond Green SG Jimmy Butler PG Goran Dragic UTIL Andrew Wiggins F Domantas Sabonis G Tim Frazier C Bam Adebayo",NA,"","","",NA
1971,938699686,"RLB18",0,241.25,"C Anthony Davis PG Victor Oladipo SG Jrue Holiday PF Lauri Markkanen SF Evan Fournier G Joe Ingles F Bobby Portis UTIL George Hill",NA,"","","",NA
1971,939162080,"SlowQueen (10/20)",0,241.25,"PG Russell Westbrook SG Jimmy Butler F Tyreke Evans UTIL Donovan Mitchell SF Jonathon Simmons G De'Aaron Fox PF JaMychal Green C Bam Adebayo",NA,"","","",NA
1971,939341981,"jimmyscat (3/3)",0,241.25,"C DeMarcus Cousins PG Kyle Lowry SG Victor Oladipo PF Taj Gibson F Domantas Sabonis SF Lance Stephenson UTIL Frank Mason III G Alec Burks",NA,"","","",NA
1971,939365669,"MJSGL (4/20)",0,241.25,"G Russell Westbrook SF DeMar DeRozan C Dwight Howard UTIL Willie Cauley-Stein PF Zach Randolph PG Michael Carter-Williams F JaMychal Green SG Frank Mason III",NA,"","","",NA
1971,939384543,"DABIZ07 (6/20)",0,241.25,"SF Paul George PG Kyle Lowry C Dwight Howard F Derrick Favors G Jrue Holiday UTIL Steven Adams PF Frank Kaminsky SG Frank Mason III",NA,"","","",NA
1971,939462125,"likenoah (11/20)",0,241.25,"PG Stephen Curry SF Kevin Durant G Kyle Lowry SG DeMar DeRozan PF Pascal Siakam F Thabo Sefolosha UTIL Cory Joseph C Zaza Pachulia",NA,"","","",NA
1971,939462134,"likenoah (20/20)",0,241.25,"PF DeMarcus Cousins UTIL Stephen Curry G Kyle Lowry F Taj Gibson C Bam Adebayo SF Dillon Brooks SG Tomas Satoransky PG Alec Burks",NA,"","","",NA
1971,939911757,"meholol (13/20)",0,241.25,"PG Russell Westbrook C Dwight Howard SF Otto Porter SG Jrue Holiday F Lauri Markkanen PF Kelly Olynyk G Michael Carter-Williams UTIL Alec Burks",NA,"","","",NA
1971,939966940,"davedave536",0,241.25,"UTIL Victor Oladipo PF Otto Porter SF Tobias Harris PG Jrue Holiday F Lauri Markkanen G Avery Bradley SG Justin Holiday C Domantas Sabonis",NA,"","","",NA
1971,940127779,"thay3r (2/4)",0,241.25,"PG Russell Westbrook C Nikola Vucevic G Elfrid Payton PF Lauri Markkanen SF Evan Fournier SG Joe Ingles F Kelly Olynyk UTIL Michael Carter-Williams",NA,"","","",NA
1971,940259655,"westy1322 (11/12)",0,241.25,"PG Kyle Lowry SF Aaron Gordon G Goran Dragic PF Lauri Markkanen UTIL Nicolas Batum SG Evan Fournier C Zach Randolph F Bojan Bogdanovic",NA,"","","",NA
1971,940279049,"hitch1022 (5/5)",0,241.25,"PF DeMarcus Cousins C Anthony Davis UTIL Dwight Howard SF Kelly Oubre Jr. G De'Aaron Fox F Kelly Olynyk PG Tomas Satoransky SG Alec Burks",NA,"","","",NA
1971,940280273,"solo2081 (2/10)",0,241.25,"PG Stephen Curry F Kevin Durant C Taj Gibson UTIL Ricky Rubio SF Evan Fournier SG Jonathon Simmons G Michael Carter-Williams PF Jonas Jerebko",NA,"","","",NA
1984,939226633,"slim728 (6/18)",0,241,"G Russell Westbrook PG Kyle Lowry C Dwight Howard F Evan Fournier SF Kelly Oubre Jr. PF Kelly Olynyk UTIL Michael Carter-Williams SG Alec Burks",NA,"","","",NA
1984,939269750,"Jimbobwae42",0,241,"PF LaMarcus Aldridge F Paul George PG Kyle Lowry UTIL Dwight Howard C Willie Cauley-Stein SF Kelly Oubre Jr. G Frank Mason III SG Alec Burks",NA,"","","",NA
1984,939678995,"skijmb (1/20)",0,241,"G Russell Westbrook UTIL Kevin Durant F Lauri Markkanen SF Evan Fournier SG Joe Ingles PG Michael Carter-Williams PF Pascal Siakam C Bam Adebayo",NA,"","","",NA
1984,939744242,"bigmac84 (1/2)",0,241,"PF DeMarcus Cousins C Anthony Davis G Elfrid Payton PG Ricky Rubio F Willie Cauley-Stein SF Michael Kidd-Gilchrist UTIL Frank Mason III SG Alec Burks",NA,"","","",NA
1984,940084022,"jpd34",0,241,"SF Kevin Durant C Karl-Anthony Towns PG Kyle Lowry G Kris Dunn UTIL Robin Lopez SG Kelly Oubre Jr. PF Jonas Jerebko F Marvin Williams",NA,"","","",NA
1984,940091415,"Bravesneverlose (17/20)",0,241,"UTIL Andre Drummond G Bradley Beal SF Otto Porter PF Tobias Harris PG Reggie Jackson SG Avery Bradley C Marcin Gortat F Wayne Ellington",NA,"","","",NA
1984,940230502,"mositatupu79 (2/3)",0,241,"SF Kevin Durant C Andre Drummond PG Kyle Lowry PF Willie Cauley-Stein UTIL Domantas Sabonis SG Joe Ingles F Bam Adebayo G Frank Mason III",NA,"","","",NA
1984,940237721,"krisc09 (1/2)",0,241,"PG Kyle Lowry G Victor Oladipo SG Bradley Beal PF Draymond Green C Nikola Vucevic SF Lance Stephenson F Marvin Williams UTIL Zaza Pachulia",NA,"","","",NA
1984,940252080,"bglife1216 (7/20)",0,241,"SG Stephen Curry G Kyle Lowry F Draymond Green SF Tyreke Evans C Taj Gibson PG Michael Carter-Williams PF Jonas Jerebko UTIL Alec Burks",NA,"","","",NA
1993,939380657,"slpanthers24 (3/6)",0,240.75,"C Anthony Davis UTIL Dwight Howard G Jimmy Butler SF Tobias Harris PF Taj Gibson F Markieff Morris PG Michael Carter-Williams SG Tomas Satoransky",NA,"","","",NA
1993,939384550,"DABIZ07 (13/20)",0,240.75,"PG Russell Westbrook C Dwight Howard G Donovan Mitchell F Taj Gibson PF Willie Cauley-Stein UTIL Zach Randolph SF Lance Stephenson SG Frank Mason III",NA,"","","",NA
1993,939762467,"YoungManRiverwalk",0,240.75,"PF DeMarcus Cousins PG Victor Oladipo SF Tobias Harris SG Kris Dunn G Reggie Jackson F Kelly Oubre Jr. UTIL Michael Carter-Williams C Skal Labissiere",NA,"","","",NA
1993,939787506,"NiceArrowShot (5/20)",0,240.75,"G Russell Westbrook SF Paul George C Dwight Howard PF Lauri Markkanen F Lance Stephenson PG Michael Carter-Williams UTIL JaMychal Green SG Alec Burks",NA,"","","",NA
1993,939960022,"jimjam43",0,240.75,"PF Kevin Durant PG Victor Oladipo F Carmelo Anthony SG Jeremy Lamb C Domantas Sabonis UTIL Zach Randolph SF Kelly Oubre Jr. G Buddy Hield",NA,"","","",NA
1993,940001567,"slipperywhendry (18/20)",0,240.75,"G Kyle Lowry PF Draymond Green SG Klay Thompson UTIL Tobias Harris PG Elfrid Payton C Taj Gibson F Zach Randolph SF JaMychal Green",NA,"","","",NA
1993,940075010,"megamike1173",0,240.75,"C Karl-Anthony Towns PG Kyle Lowry PF Draymond Green SG Jimmy Butler SF Jeremy Lamb UTIL Jerian Grant F Lance Stephenson G Tony Parker",NA,"","","",NA
1993,940110624,"geemerboy (2/4)",0,240.75,"SG Victor Oladipo UTIL Marc Gasol C Dwight Howard SF Tobias Harris G Elfrid Payton PG Ricky Rubio PF Kelly Olynyk F Bam Adebayo",NA,"","","",NA
1993,940152375,"kingn230",0,240.75,"SG Stephen Curry PG Kyle Lowry G Donovan Mitchell SF Otto Porter PF Taj Gibson UTIL Domantas Sabonis C Bam Adebayo F Chandler Parsons",NA,"","","",NA
1993,940180102,"Frunkis30 (6/17)",0,240.75,"F Kevin Durant C Dwight Howard PF Draymond Green PG Elfrid Payton G Ricky Rubio UTIL Domantas Sabonis SF Joe Ingles SG Alec Burks",NA,"","","",NA
1993,940252076,"bglife1216 (3/20)",0,240.75,"SF Kevin Durant C Nikola Vucevic SG Klay Thompson PG Elfrid Payton UTIL Kyle Anderson F Evan Fournier PF Serge Ibaka G Michael Carter-Williams",NA,"","","",NA
1993,940281480,"khay86 (7/20)",0,240.75,"C DeMarcus Cousins SG Stephen Curry SF Otto Porter PG Elfrid Payton UTIL Evan Fournier G Bojan Bogdanovic PF David West F Royce O'Neale",NA,"","","",NA
2005,939347559,"CMORTON72 (10/20)",0,240.5,"PF Draymond Green C Nikola Vucevic PG Goran Dragic SG Klay Thompson G Donovan Mitchell UTIL Derrick Favors SF JaMychal Green F Bam Adebayo",NA,"","","",NA
2005,939347562,"CMORTON72 (13/20)",0,240.5,"SG Stephen Curry PF Aaron Gordon C Nikola Vucevic SF Otto Porter G Elfrid Payton F JaMychal Green PG Tim Frazier UTIL Bam Adebayo",NA,"","","",NA
2005,939460551,"wdoubleuw (19/20)",0,240.5,"UTIL DeMarcus Cousins G Kyle Lowry SG Jrue Holiday C Steven Adams PF Willie Cauley-Stein F Serge Ibaka PG Michael Carter-Williams SF JaMychal Green",NA,"","","",NA
2005,939707263,"ekay415 (1/2)",0,240.5,"PF Anthony Davis UTIL Karl-Anthony Towns PG Kyle Lowry SF Otto Porter F Buddy Hield C Kelly Olynyk G Tomas Satoransky SG Alec Burks",NA,"","","",NA
2005,939707264,"ekay415 (2/2)",0,240.5,"PF Anthony Davis UTIL Karl-Anthony Towns PG Kyle Lowry SF Otto Porter F Buddy Hield C Kelly Olynyk G Tomas Satoransky SG Alec Burks",NA,"","","",NA
2005,939788154,"NiceArrowShot (9/20)",0,240.5,"G Russell Westbrook UTIL Karl-Anthony Towns C Dwight Howard PF Willie Cauley-Stein F Serge Ibaka PG Michael Carter-Williams SF JaMychal Green SG Alec Burks",NA,"","","",NA
2005,939809593,"I-HATE-PANTS (2/20)",0,240.5,"G Russell Westbrook C Marc Gasol SG Jimmy Butler PF Lauri Markkanen SF Bojan Bogdanovic F Kelly Olynyk PG Michael Carter-Williams UTIL Pascal Siakam",NA,"","","",NA
2005,939908901,"Jakehunter (7/20)",0,240.5,"UTIL Russell Westbrook C Karl-Anthony Towns G Donovan Mitchell F Lauri Markkanen PF Domantas Sabonis PG Michael Carter-Williams SF JaMychal Green SG Andre Roberson",NA,"","","",NA
2005,939946063,"jpm07006 (2/4)",0,240.5,"SG Stephen Curry G Kyle Lowry SF Otto Porter PG Elfrid Payton PF James Johnson UTIL Jonathon Simmons C Kelly Olynyk F Frank Kaminsky",NA,"","","",NA
2005,940021973,"themaltinc",0,240.5,"UTIL Stephen Curry C Karl-Anthony Towns PG Kyle Lowry PF Taj Gibson SF Jonathon Simmons SG Kelly Oubre Jr. F Bam Adebayo G Alec Burks",NA,"","","",NA
2005,940093921,"jarmon19",0,240.5,"UTIL Anthony Davis F Derrick Favors G Dion Waiters SF Nicolas Batum PF James Johnson PG Ricky Rubio C Robin Lopez SG Alec Burks",NA,"","","",NA
2005,940209223,"Hojo_58 (1/4)",0,240.5,"G Russell Westbrook UTIL Karl-Anthony Towns C Dwight Howard PF Willie Cauley-Stein F Serge Ibaka PG Michael Carter-Williams SF JaMychal Green SG Alec Burks",NA,"","","",NA
2005,940238458,"yumyumgivemesome",0,240.5,"PG Russell Westbrook SG Stephen Curry C Andre Drummond G Kelly Oubre Jr. SF JaMychal Green F Bam Adebayo UTIL Alec Burks PF Marreese Speights",NA,"","","",NA
2005,940286773,"sreim33 (4/8)",0,240.5,"UTIL Russell Westbrook C Anthony Davis PG Kyle Lowry F Kelly Olynyk PF JaMychal Green SF Jonas Jerebko SG Tomas Satoransky G Alec Burks",NA,"","","",NA
2005,940298619,"jdezzie383 (2/4)",0,240.5,"G Jimmy Butler C Nikola Vucevic PG Donovan Mitchell SG Dion Waiters UTIL Reggie Jackson SF Jeremy Lamb F Thaddeus Young PF Serge Ibaka",NA,"","","",NA
2020,939263167,"perilous (1/20)",0,240.25,"PG Russell Westbrook C Karl-Anthony Towns SG Jimmy Butler G Ricky Rubio F Joe Ingles SF JaMychal Green UTIL Bam Adebayo PF Marvin Williams",NA,"","","",NA
2020,939644848,"turntwo76",0,240.25,"SF Kevin Durant PF Aaron Gordon UTIL Tyreke Evans PG Elfrid Payton C Steven Adams F Jeremy Lamb SG Tyus Jones G Alec Burks",NA,"","","",NA
2020,939809610,"I-HATE-PANTS (19/20)",0,240.25,"G Russell Westbrook SG Stephen Curry PF Lauri Markkanen UTIL Willie Cauley-Stein C Kelly Olynyk PG Michael Carter-Williams F JaMychal Green SF Michael Kidd-Gilchrist",NA,"","","",NA
2020,939822260,"j4k3b (9/11)",0,240.25,"PF Anthony Davis PG Kyle Lowry UTIL Nikola Vucevic SF Otto Porter C Steven Adams G Michael Carter-Williams F Frank Kaminsky SG Alec Burks",NA,"","","",NA
2020,939967416,"CoryFF (2/2)",0,240.25,"PG Stephen Curry C Dwight Howard SG Klay Thompson SF Otto Porter F Jeremy Lamb G Tyus Jones PF Markieff Morris UTIL George Hill",NA,"","","",NA
2020,939976588,"mbperalt2012 (10/20)",0,240.25,"UTIL Karl-Anthony Towns PG Kyle Lowry C Dwight Howard PF Otto Porter SG Evan Fournier SF Jonathon Simmons F Kelly Oubre Jr. G Tomas Satoransky",NA,"","","",NA
2026,939195141,"GreyPoupon (19/20)",0,240,"C Andre Drummond SG Jimmy Butler G Goran Dragic PF Lauri Markkanen SF Jeremy Lamb F Willie Cauley-Stein UTIL Domantas Sabonis PG Michael Carter-Williams",NA,"","","",NA
2026,939327307,"gundacker (15/20)",0,240,"PF LaMarcus Aldridge PG Kyle Lowry SG Victor Oladipo C Dwight Howard SF Otto Porter F JaMychal Green G Frank Mason III UTIL Jakob Poeltl",NA,"","","",NA
2026,939408647,"chrisn671 (18/20)",0,240,"SF Kevin Durant PG Kyle Lowry F Andrew Wiggins SG Nicolas Batum G Evan Fournier PF Willie Cauley-Stein C Kelly Olynyk UTIL Bam Adebayo",NA,"","","",NA
2026,939474265,"pitavita",0,240,"C Karl-Anthony Towns PG Kyle Lowry SF Aaron Gordon SG Jimmy Butler PF Carmelo Anthony F Kelly Oubre Jr. G Alec Burks UTIL Nick Young",NA,"","","",NA
2026,939483278,"indy10000",0,240,"UTIL Kyle Lowry PF Aaron Gordon C Dwight Howard SF Otto Porter PG Elfrid Payton F Taj Gibson G Kelly Oubre Jr. SG Alec Burks",NA,"","","",NA
2026,939664113,"blitzology (18/20)",0,240,"PG Stephen Curry SG Bradley Beal PF Draymond Green UTIL Lauri Markkanen C Steven Adams SF Joe Ingles F Kelly Olynyk G Frank Mason III",NA,"","","",NA
2026,939735041,"Hooligans (9/20)",0,240,"UTIL Russell Westbrook PG Kyle Lowry C Nikola Vucevic PF Derrick Favors F Kelly Olynyk G Michael Carter-Williams SF JaMychal Green SG Alec Burks",NA,"","","",NA
2026,939822229,"pujolsjunkie (19/20)",0,240,"G Stephen Curry PF Draymond Green SF Otto Porter UTIL Tobias Harris PG Ricky Rubio F Willie Cauley-Stein SG Joe Ingles C Frank Kaminsky",NA,"","","",NA
2026,940073791,"ttaylor001 (1/3)",0,240,"C Andre Drummond F LaMarcus Aldridge G Bradley Beal SF Otto Porter SG Avery Bradley PF Kelly Olynyk PG Ish Smith UTIL Tomas Satoransky",NA,"","","",NA
2026,940113196,"mosyadig (17/20)",0,240,"UTIL Russell Westbrook PG Kyle Lowry C Nikola Vucevic F Derrick Favors PF Kelly Olynyk G Michael Carter-Williams SF JaMychal Green SG Alec Burks",NA,"","","",NA
2026,940238588,"BirdsOfPray (2/12)",0,240,"F LaMarcus Aldridge PG Victor Oladipo SG Bradley Beal UTIL Jeff Teague G Kris Dunn C Domantas Sabonis SF Jonas Jerebko PF Marvin Williams",NA,"","","",NA
2026,940266355,"MikeMacCombie (11/20)",0,240,"PG Russell Westbrook C Karl-Anthony Towns SG Kris Dunn F Lauri Markkanen UTIL Rajon Rondo PF Kelly Olynyk G Michael Carter-Williams SF JaMychal Green",NA,"","","",NA
2026,940266356,"MikeMacCombie (12/20)",0,240,"PG Russell Westbrook C Karl-Anthony Towns SG Kris Dunn F Lauri Markkanen UTIL Rajon Rondo PF Kelly Olynyk G Michael Carter-Williams SF JaMychal Green",NA,"","","",NA
2026,940266357,"MikeMacCombie (13/20)",0,240,"PG Russell Westbrook C Karl-Anthony Towns SG Kris Dunn F Lauri Markkanen UTIL Rajon Rondo PF Kelly Olynyk G Michael Carter-Williams SF JaMychal Green",NA,"","","",NA
2026,940266358,"MikeMacCombie (14/20)",0,240,"PG Russell Westbrook C Karl-Anthony Towns SG Kris Dunn F Lauri Markkanen UTIL Rajon Rondo PF Kelly Olynyk G Michael Carter-Williams SF JaMychal Green",NA,"","","",NA
2026,940266359,"MikeMacCombie (15/20)",0,240,"PG Russell Westbrook C Karl-Anthony Towns SG Kris Dunn F Lauri Markkanen UTIL Rajon Rondo PF Kelly Olynyk G Michael Carter-Williams SF JaMychal Green",NA,"","","",NA
2026,940266360,"MikeMacCombie (16/20)",0,240,"PG Russell Westbrook C Karl-Anthony Towns SG Kris Dunn F Lauri Markkanen UTIL Rajon Rondo PF Kelly Olynyk G Michael Carter-Williams SF JaMychal Green",NA,"","","",NA
2026,940266361,"MikeMacCombie (17/20)",0,240,"PG Russell Westbrook C Karl-Anthony Towns SG Kris Dunn F Lauri Markkanen UTIL Rajon Rondo PF Kelly Olynyk G Michael Carter-Williams SF JaMychal Green",NA,"","","",NA
2026,940266362,"MikeMacCombie (18/20)",0,240,"PG Russell Westbrook C Karl-Anthony Towns SG Kris Dunn F Lauri Markkanen UTIL Rajon Rondo PF Kelly Olynyk G Michael Carter-Williams SF JaMychal Green",NA,"","","",NA
2026,940266363,"MikeMacCombie (19/20)",0,240,"PG Russell Westbrook C Karl-Anthony Towns SG Kris Dunn F Lauri Markkanen UTIL Rajon Rondo PF Kelly Olynyk G Michael Carter-Williams SF JaMychal Green",NA,"","","",NA
2026,940266364,"MikeMacCombie (20/20)",0,240,"PG Russell Westbrook C Karl-Anthony Towns SG Kris Dunn F Lauri Markkanen UTIL Rajon Rondo PF Kelly Olynyk G Michael Carter-Williams SF JaMychal Green",NA,"","","",NA
2047,939313067,"swordsman (8/12)",0,239.75,"SG Bradley Beal C Dwight Howard UTIL Donovan Mitchell PF Otto Porter PG Elfrid Payton F Nicolas Batum SF Jonathon Simmons G Tim Frazier",NA,"","","",NA
2047,939365714,"MJSGL (7/20)",0,239.75,"F LaMarcus Aldridge SG DeMar DeRozan C Dwight Howard SF Tobias Harris PF Lauri Markkanen UTIL Zach Randolph PG Rajon Rondo G Frank Mason III",NA,"","","",NA
2047,939796972,"sheetrockrn",0,239.75,"SF Aaron Gordon C Dwight Howard UTIL Jimmy Butler SG Klay Thompson PG Mario Chalmers PF Domantas Sabonis F Zach Randolph G Lance Stephenson",NA,"","","",NA
2047,939829104,"dean78904 (3/4)",0,239.75,"UTIL DeMarcus Cousins G Goran Dragic SF Nicolas Batum PF James Johnson C Steven Adams SG Evan Fournier F Kelly Olynyk PG Michael Carter-Williams",NA,"","","",NA
2047,939863635,"ADH6676 (17/20)",0,239.75,"UTIL Russell Westbrook F Aaron Gordon G Elfrid Payton PF Lauri Markkanen C Domantas Sabonis SG Joe Ingles PG Michael Carter-Williams SF JaMychal Green",NA,"","","",NA
2047,940046259,"ZENSTER (11/18)",0,239.75,"UTIL Stephen Curry PG Kyle Lowry PF Carmelo Anthony SF Otto Porter C Steven Adams G Tyus Jones F Kelly Olynyk SG Alec Burks",NA,"","","",NA
2047,940065449,"ZENSTER (14/18)",0,239.75,"UTIL Stephen Curry PG Kyle Lowry PF Carmelo Anthony SF Otto Porter C Steven Adams G Tyus Jones F Kelly Olynyk SG Alec Burks",NA,"","","",NA
2047,940195115,"migs2015",0,239.75,"C Karl-Anthony Towns PG Kyle Lowry UTIL Dwight Howard SF Otto Porter PF James Johnson F Jonathon Simmons G Michael Carter-Williams SG Tomas Satoransky",NA,"","","",NA
2047,940235929,"ddettro (8/20)",0,239.75,"PG Russell Westbrook C Nikola Vucevic G Elfrid Payton PF Lauri Markkanen UTIL Ricky Rubio F Zach Randolph SF Bojan Bogdanovic SG Alec Burks",NA,"","","",NA
2047,940237936,"jensenbud13",0,239.75,"PG Russell Westbrook SG Klay Thompson F Tobias Harris PF Lauri Markkanen C Steven Adams SF Thaddeus Young G Kelly Oubre Jr. UTIL Zaza Pachulia",NA,"","","",NA
2057,939389770,"bigflyy",0,239.5,"PG Kyle Lowry G Victor Oladipo C Dwight Howard SF Otto Porter F Lauri Markkanen PF Willie Cauley-Stein UTIL Tyus Jones SG Tomas Satoransky",NA,"","","",NA
2057,939421796,"Dshook420 (3/3)",0,239.5,"SF Kevin Durant F Paul George UTIL Carmelo Anthony PF James Johnson C Taj Gibson G Ricky Rubio PG Michael Carter-Williams SG Garrett Temple",NA,"","","",NA
2057,939462120,"likenoah (6/20)",0,239.5,"PF DeMarcus Cousins PG Kyle Lowry SF DeMar DeRozan UTIL Marc Gasol C Bam Adebayo SG Dillon Brooks G Thabo Sefolosha F Marvin Williams",NA,"","","",NA
2057,939499568,"jay_teee33",0,239.5,"PG Russell Westbrook SG Stephen Curry SF Otto Porter PF Domantas Sabonis C Jonas Valanciunas G Buddy Hield F Marvin Williams UTIL Cody Zeller",NA,"","","",NA
2057,939845457,"JimmyMorgan",0,239.5,"F LaMarcus Aldridge UTIL Kyle Lowry SF Otto Porter PG Elfrid Payton PF Lauri Markkanen G Ricky Rubio C Willie Cauley-Stein SG Alec Burks",NA,"","","",NA
2057,939854147,"L3gOnD (11/20)",0,239.5,"UTIL Karl-Anthony Towns SG Bradley Beal PF Draymond Green C Nikola Vucevic SF Nicolas Batum F Joe Ingles PG Michael Carter-Williams G Alec Burks",NA,"","","",NA
2057,939854151,"L3gOnD (15/20)",0,239.5,"PG Kyle Lowry PF Draymond Green C Nikola Vucevic SG Donovan Mitchell UTIL Lauri Markkanen SF Nicolas Batum G Michael Carter-Williams F Bam Adebayo",NA,"","","",NA
2057,940267215,"2wayyo",0,239.5,"F Anthony Davis UTIL Andre Drummond PF LaMarcus Aldridge SF Tyreke Evans PG Michael Carter-Williams C Bam Adebayo G Alec Burks SG Andrew Harrison",NA,"","","",NA
2057,940281490,"khay86 (17/20)",0,239.5,"F DeMarcus Cousins PG Stephen Curry UTIL Kyle Lowry SG Evan Fournier PF Domantas Sabonis SF Omri Casspi G Alec Burks C Marreese Speights",NA,"","","",NA
2066,939664193,"blitzology (19/20)",0,239.25,"G Stephen Curry UTIL Marc Gasol C Nikola Vucevic PG Elfrid Payton F Lauri Markkanen SF Joe Ingles PF Kelly Olynyk SG Frank Mason III",NA,"","","",NA
2066,939803662,"Miller421 (20/20)",0,239.25,"SF Kevin Durant UTIL Andre Drummond C Nikola Vucevic G Ricky Rubio SG Evan Fournier F Kelly Olynyk PG Michael Carter-Williams PF Bam Adebayo",NA,"","","",NA
2066,939908897,"Jakehunter (3/20)",0,239.25,"G Russell Westbrook UTIL Nikola Vucevic SG Donovan Mitchell F Lauri Markkanen C Domantas Sabonis SF Joe Ingles PG Michael Carter-Williams PF Bam Adebayo",NA,"","","",NA
2066,940112134,"OoDeBaby (10/10)",0,239.25,"G Russell Westbrook PG Kyle Lowry SF Aaron Gordon SG Kris Dunn UTIL Michael Carter-Williams PF JaMychal Green C Bam Adebayo F Marvin Williams",NA,"","","",NA
2066,940192550,"IceMaker711",0,239.25,"UTIL Paul George G Kyle Lowry C Dwight Howard SF Otto Porter F Taj Gibson PF Domantas Sabonis SG Kelly Oubre Jr. PG Alec Burks",NA,"","","",NA
2066,940222797,"movethatdirt",0,239.25,"UTIL Karl-Anthony Towns C Dwight Howard F Draymond Green SF Otto Porter G Elfrid Payton PF Domantas Sabonis SG Kelly Oubre Jr. PG Tomas Satoransky",NA,"","","",NA
2066,940259647,"westy1322 (3/12)",0,239.25,"PG Russell Westbrook G Kyle Lowry C Dwight Howard PF Taj Gibson SF Evan Fournier F Kelly Olynyk SG Tomas Satoransky UTIL Alec Burks",NA,"","","",NA
2066,940260459,"Ironswag82",0,239.25,"C Andre Drummond UTIL Kyle Lowry PF Derrick Favors SF Tobias Harris G Elfrid Payton PG Reggie Jackson F JaMychal Green SG Garrett Temple",NA,"","","",NA
2066,940279956,"magicpower",0,239.25,"PG Kyle Lowry SG DeMar DeRozan C Dwight Howard UTIL Donovan Mitchell SF Denzel Valentine F Thaddeus Young G Michael Carter-Williams PF Bam Adebayo",NA,"","","",NA
2066,940289999,"antwamboldt",0,239.25,"C Andre Drummond PG Kyle Lowry SG Bradley Beal PF Otto Porter SF Evan Fournier F Kelly Olynyk G Michael Carter-Williams UTIL JaMychal Green",NA,"","","",NA
2076,939469642,"mikiamit (3/20)",0,239,"SG Stephen Curry C Marc Gasol PF Draymond Green UTIL Nikola Vucevic SF Jeremy Lamb PG Tyus Jones F Omri Casspi G Alec Burks",NA,"","","",NA
2076,939532928,"donnellywj (1/2)",0,239,"UTIL Kyle Lowry C Dwight Howard SG Klay Thompson PF Otto Porter G Reggie Jackson SF Jeremy Lamb F Evan Fournier PG Alec Burks",NA,"","","",NA
2076,939533068,"rd1988 (4/10)",0,239,"PG Stephen Curry PF Draymond Green C Nikola Vucevic G Elfrid Payton F Lauri Markkanen SG Evan Fournier SF Michael Kidd-Gilchrist UTIL Frank Mason III",NA,"","","",NA
2076,939787801,"brianhaydt (1/3)",0,239,"C Karl-Anthony Towns G Victor Oladipo PF Carmelo Anthony SG Jrue Holiday PG Elfrid Payton F Jeremy Lamb SF Bojan Bogdanovic UTIL Bam Adebayo",NA,"","","",NA
2076,939863638,"ADH6676 (20/20)",0,239,"UTIL Russell Westbrook SG Stephen Curry PF Lauri Markkanen F Evan Fournier G De'Aaron Fox PG Michael Carter-Williams SF JaMychal Green C Bam Adebayo",NA,"","","",NA
2076,940094992,"chicago86",0,239,"C DeMarcus Cousins SG Stephen Curry G Ricky Rubio PF Thaddeus Young SF Kelly Oubre Jr. F Josh Richardson UTIL Danny Green PG George Hill",NA,"","","",NA
2076,940158427,"ohiostsucks24 (13/17)",0,239,"C Anthony Davis SG DeMar DeRozan SF Otto Porter PG Elfrid Payton PF Lauri Markkanen UTIL Lance Stephenson G Michael Carter-Williams F Bam Adebayo",NA,"","","",NA
2076,940189363,"hawk2116",0,239,"PG Russell Westbrook UTIL Aaron Gordon C Dwight Howard PF James Johnson G Kelly Oubre Jr. F Josh Richardson SF JaMychal Green SG Alec Burks",NA,"","","",NA
2076,940201830,"jamieg17 (2/2)",0,239,"PG Kyle Lowry SG DeMar DeRozan SF Aaron Gordon G Elfrid Payton F Thaddeus Young PF Willie Cauley-Stein UTIL Domantas Sabonis C Frank Kaminsky",NA,"","","",NA
