"Rank","EntryId","EntryName","TimeRemaining","Points","Lineup","X","Player","Roster.Position","X.Drafted","FPTS"
1022,940109548,"Skgd36 (3/3)",0,260.5,"G Russell Westbrook UTIL Victor Oladipo C Dwight Howard F Lauri Markkanen PF Serge Ibaka PG Michael Carter-Williams SF JaMychal Green SG Alec Burks",NA,"","","",NA
1022,940111262,"caliways52 (3/8)",0,260.5,"PG Stephen Curry SF Aaron Gordon UTIL Nikola Vucevic SG Donovan Mitchell C Willie Cauley-Stein PF Kelly Olynyk G Michael Carter-Williams F JaMychal Green",NA,"","","",NA
1022,940269014,"thatdudeJason",0,260.5,"UTIL LaMarcus Aldridge SF Paul George SG Jimmy Butler G Tyreke Evans PF Andrew Wiggins F Kelly Oubre Jr. C Bam Adebayo PG Alec Burks",NA,"","","",NA
1022,940297623,"pichon4ever73 (1/2)",0,260.5,"PG Stephen Curry SF Kevin Durant PF Aaron Gordon SG Klay Thompson G Evan Fournier UTIL Stanley Johnson F OG Anunoby C Zaza Pachulia",NA,"","","",NA
1040,939327304,"gundacker (12/20)",0,260.25,"PG Russell Westbrook C Karl-Anthony Towns SF Paul George PF Tobias Harris F JaMychal Green G Frank Mason III SG Alec Burks UTIL Jakob Poeltl",NA,"","","",NA
1040,939478507,"the-griffin",0,260.25,"C Andre Drummond F LaMarcus Aldridge G Victor Oladipo UTIL Ricky Rubio SF Evan Fournier PF Zach Randolph PG Tyus Jones SG Shaun Livingston",NA,"","","",NA
1040,939572702,"dan.tsbi (3/4)",0,260.25,"UTIL Andre Drummond SF DeMar DeRozan SG Jimmy Butler PF Taj Gibson PG Ricky Rubio F Willie Cauley-Stein C Robin Lopez G Tim Frazier",NA,"","","",NA
1040,939753951,"jakeharris31",0,260.25,"PF LaMarcus Aldridge PG Kyle Lowry SG Victor Oladipo C Dwight Howard F Joe Ingles SF Kelly Oubre Jr. UTIL Michael Carter-Williams G Tomas Satoransky",NA,"","","",NA
1040,939786770,"surajdave (15/20)",0,260.25,"SF Kevin Durant UTIL Karl-Anthony Towns PG Elfrid Payton F Lauri Markkanen C Steven Adams PF Taj Gibson G Michael Carter-Williams SG Alec Burks",NA,"","","",NA
1040,939852633,"brianLiza",0,260.25,"PG Russell Westbrook C Andre Drummond F Willie Cauley-Stein UTIL Zach Randolph SG Joe Ingles PF Serge Ibaka G Tyus Jones SF Lance Stephenson",NA,"","","",NA
1040,939946062,"jpm07006 (1/4)",0,260.25,"PG Stephen Curry UTIL Karl-Anthony Towns SF Otto Porter G Elfrid Payton C Steven Adams PF Domantas Sabonis F Frank Kaminsky SG Tomas Satoransky",NA,"","","",NA
1040,940185011,"hitch1022 (3/5)",0,260.25,"PG Stephen Curry SF Kevin Durant C Dwight Howard PF Willie Cauley-Stein UTIL Robin Lopez F Kelly Oubre Jr. G Tomas Satoransky SG Alec Burks",NA,"","","",NA
1040,940234669,"chadfu23 (1/2)",0,260.25,"G Stephen Curry SF Kevin Durant SG Jimmy Butler PG Elfrid Payton PF Serge Ibaka UTIL Michael Carter-Williams C Bam Adebayo F Dillon Brooks",NA,"","","",NA
1040,940271270,"esotericpa",0,260.25,"PF Kevin Durant PG Kyle Lowry C Dwight Howard SF Nicolas Batum UTIL Steven Adams F Evan Fournier SG Tomas Satoransky G Alec Burks",NA,"","","",NA
1040,940273403,"scottp11 (12/19)",0,260.25,"PG Kyle Lowry SG Victor Oladipo SF Aaron Gordon F Tyreke Evans UTIL Thaddeus Young C Willie Cauley-Stein G Michael Carter-Williams PF Bam Adebayo",NA,"","","",NA
1040,940274695,"DattyBrixx33 (1/2)",0,260.25,"C Karl-Anthony Towns PF LaMarcus Aldridge SG Donovan Mitchell SF Tobias Harris UTIL Elfrid Payton F Justin Holiday PG De'Aaron Fox G Bogdan Bogdanovic",NA,"","","",NA
1040,940298054,"xxhollywood954xx",0,260.25,"G Stephen Curry SF Kevin Durant SG Jimmy Butler PG Elfrid Payton PF Serge Ibaka UTIL Michael Carter-Williams C Bam Adebayo F Dillon Brooks",NA,"","","",NA
1053,939084592,"mikethevike",0,260,"PG Russell Westbrook PF DeMarcus Cousins G Victor Oladipo SF Jeremy Lamb SG Thabo Sefolosha F Omri Casspi UTIL Jameer Nelson C Zaza Pachulia",NA,"","","",NA
1053,939263177,"perilous (11/20)",0,260,"PG Russell Westbrook C Karl-Anthony Towns SG Donovan Mitchell F Evan Fournier UTIL Jonathon Simmons G Michael Carter-Williams SF JaMychal Green PF Bam Adebayo",NA,"","","",NA
1053,939263179,"perilous (13/20)",0,260,"PF Kevin Durant C Andre Drummond SG Jimmy Butler UTIL Myles Turner PG Ricky Rubio G Michael Carter-Williams SF JaMychal Green F Marvin Williams",NA,"","","",NA
1053,939263180,"perilous (14/20)",0,260,"PF Kevin Durant SF Paul George SG Jimmy Butler PG Elfrid Payton G Ricky Rubio C Serge Ibaka F JaMychal Green UTIL Bam Adebayo",NA,"","","",NA
1053,939380659,"slpanthers24 (5/6)",0,260,"F Aaron Gordon SF Andrew Wiggins SG Donovan Mitchell PG Kris Dunn G Elfrid Payton PF Lauri Markkanen C Taj Gibson UTIL Robin Lopez",NA,"","","",NA
1053,939384549,"DABIZ07 (12/20)",0,260,"PG Russell Westbrook C Dwight Howard G Donovan Mitchell UTIL Steven Adams F Zach Randolph SF Bojan Bogdanovic SG Lance Stephenson PF Kelly Olynyk",NA,"","","",NA
1053,939468398,"adrsabali1",0,260,"PF DeMarcus Cousins F Aaron Gordon UTIL Jimmy Butler G Kyle Anderson C Domantas Sabonis SG Jonathon Simmons SF Rudy Gay PG Alec Burks",NA,"","","",NA
1053,939470990,"howiet21",0,260,"PG Russell Westbrook SG Victor Oladipo G Bradley Beal SF Dion Waiters C Zach Randolph PF Markieff Morris F Álex Abrines UTIL Mike Scott",NA,"","","",NA
1053,939491749,"hubba1de (1/4)",0,260,"PG Kyle Lowry C Dwight Howard G Donovan Mitchell SF Otto Porter PF Tobias Harris UTIL Steven Adams F Willie Cauley-Stein SG Tomas Satoransky",NA,"","","",NA
1053,939815105,"duball16",0,260,"C Karl-Anthony Towns G Kyle Lowry UTIL Dwight Howard SF Otto Porter F Derrick Favors PF Kelly Olynyk PG Michael Carter-Williams SG Alec Burks",NA,"","","",NA
1053,939819028,"billyetuck",0,260,"SF Paul George G DeMar DeRozan C Marc Gasol F Carmelo Anthony PG Kyle Anderson SG Evan Fournier UTIL Serge Ibaka PF David West",NA,"","","",NA
1053,939967484,"seanywap (1/2)",0,260,"SF Aaron Gordon F Draymond Green UTIL Jimmy Butler SG Klay Thompson PG Jrue Holiday G Avery Bradley PF Rudy Gay C Frank Kaminsky",NA,"","","",NA
1053,939972390,"seanywap (2/2)",0,260,"SF Aaron Gordon F Draymond Green UTIL Jimmy Butler SG Klay Thompson PG Jrue Holiday G Avery Bradley PF Rudy Gay C Frank Kaminsky",NA,"","","",NA
1053,940072908,"ramallah1",0,260,"C Anthony Davis SF Aaron Gordon F Otto Porter PG Elfrid Payton G Jeremy Lamb PF Willie Cauley-Stein UTIL Lance Stephenson SG Alec Burks",NA,"","","",NA
1053,940153898,"dkiefr19 (2/20)",0,260,"G Russell Westbrook SG Stephen Curry PG Elfrid Payton C Steven Adams F Joe Ingles UTIL De'Aaron Fox PF Pascal Siakam SF Andre Roberson",NA,"","","",NA
1053,940195588,"Chase999",0,260,"PG Kyle Lowry SG Victor Oladipo UTIL Aaron Gordon C Nikola Vucevic F Tobias Harris SF Kelly Oubre Jr. PF Kelly Olynyk G Alec Burks",NA,"","","",NA
1053,940257671,"p-townplayers (2/4)",0,260,"F DeMarcus Cousins PF Anthony Davis SF Kevin Durant C Kelly Olynyk PG Michael Carter-Williams SG Alec Burks G Fred VanVleet UTIL Luke Kennard",NA,"","","",NA
1053,940261573,"p-townplayers (3/4)",0,260,"F DeMarcus Cousins PF Anthony Davis SF Kevin Durant C Kelly Olynyk PG Michael Carter-Williams SG Alec Burks G Fred VanVleet UTIL Luke Kennard",NA,"","","",NA
1053,940297204,"bconbucks",0,260,"F Kevin Durant G Kyle Lowry C Dwight Howard SF Otto Porter UTIL Steven Adams PF Kelly Olynyk PG Michael Carter-Williams SG Alec Burks",NA,"","","",NA
1053,940304908,"transjeff",0,260,"PF Anthony Davis PG Stephen Curry SF DeMar DeRozan SG Jrue Holiday C Marcin Gortat UTIL Alec Burks F David West G Jodie Meeks",NA,"","","",NA
1073,939678999,"skijmb (5/20)",0,259.75,"UTIL Russell Westbrook G Jimmy Butler SG Donovan Mitchell F Lauri Markkanen C Domantas Sabonis SF Joe Ingles PG Michael Carter-Williams PF Pascal Siakam",NA,"","","",NA
1073,939694682,"Endzonedance23 (1/2)",0,259.75,"F Anthony Davis G Kyle Lowry UTIL Victor Oladipo SF Aaron Gordon PG Michael Carter-Williams C Bam Adebayo PF Frank Kaminsky SG Andre Roberson",NA,"","","",NA
1073,939735033,"Hooligans (1/20)",0,259.75,"UTIL Russell Westbrook PG Kyle Lowry C Nikola Vucevic SF Jeremy Lamb F Zach Randolph PF Kelly Olynyk G Michael Carter-Williams SG Alec Burks",NA,"","","",NA
1073,940239969,"outlaw53",0,259.75,"SG Stephen Curry UTIL Andre Drummond G Kyle Lowry SF Andrew Wiggins PG Michael Carter-Williams F JaMychal Green C Bam Adebayo PF Marvin Williams",NA,"","","",NA
1077,939576658,"tclark12 (1/2)",0,259.5,"SF Kevin Durant G Kyle Lowry UTIL Victor Oladipo C Dwight Howard F Bojan Bogdanovic PG Michael Carter-Williams PF Bam Adebayo SG Alec Burks",NA,"","","",NA
1077,939586004,"icebloomer",0,259.5,"PF Anthony Davis PG Kyle Lowry F Aaron Gordon SF Thaddeus Young C Willie Cauley-Stein SG Kelly Oubre Jr. UTIL Jerian Grant G Alec Burks",NA,"","","",NA
1077,940120234,"bkhanlin (8/8)",0,259.5,"PG Victor Oladipo SF Aaron Gordon SG Tyreke Evans F Derrick Favors G Jeremy Lamb PF Domantas Sabonis C Robin Lopez UTIL Kelly Oubre Jr.",NA,"","","",NA
1077,940236863,"Icon52085 (5/13)",0,259.5,"PG Russell Westbrook C Andre Drummond SG Klay Thompson UTIL Ricky Rubio PF Serge Ibaka F Kelly Olynyk SF JaMychal Green G Alec Burks",NA,"","","",NA
1077,940285461,"jmurrayr (3/5)",0,259.5,"UTIL DeMarcus Cousins PG Victor Oladipo F Lauri Markkanen SG Jeremy Lamb PF Domantas Sabonis C Serge Ibaka SF Kelly Oubre Jr. G Jerian Grant",NA,"","","",NA
1082,939419661,"rhm1960 (8/10)",0,259.25,"PF Kevin Durant PG Kyle Lowry F Otto Porter SF Nicolas Batum C Steven Adams SG Evan Fournier UTIL Bojan Bogdanovic G Tomas Satoransky",NA,"","","",NA
1082,939495819,"viewfromtop (1/2)",0,259.25,"SF Kevin Durant PG Kyle Lowry UTIL Victor Oladipo C Dwight Howard PF Kelly Olynyk G Michael Carter-Williams F JaMychal Green SG Alec Burks",NA,"","","",NA
1082,939520713,"ahitspat (18/20)",0,259.25,"G Russell Westbrook PG Kyle Lowry SF Aaron Gordon PF Willie Cauley-Stein C Robin Lopez UTIL Michael Carter-Williams F Bam Adebayo SG Garrett Temple",NA,"","","",NA
1082,939626914,"Shrimp5",0,259.25,"SG DeMar DeRozan UTIL Aaron Gordon PF Otto Porter SF Tobias Harris PG Mario Chalmers G Evan Fournier F Domantas Sabonis C Zach Randolph",NA,"","","",NA
1082,939957984,"CoryFF (1/2)",0,259.25,"C Andre Drummond PG Kyle Lowry SG DeMar DeRozan SF Andrew Wiggins PF Derrick Favors UTIL Jonas Valanciunas G George Hill F Kevon Looney",NA,"","","",NA
1082,940121000,"HeroText (3/3)",0,259.25,"UTIL Victor Oladipo G DeMar DeRozan C Dwight Howard SF Otto Porter F Tobias Harris SG Nicolas Batum PG Ish Smith PF Marvin Williams",NA,"","","",NA
1082,940203151,"laces.out.dan (3/8)",0,259.25,"C Karl-Anthony Towns SF Paul George PF Draymond Green SG Jimmy Butler PG Ricky Rubio F Domantas Sabonis G George Hill UTIL Skal Labissiere",NA,"","","",NA
1082,940211573,"Frunkis30 (8/17)",0,259.25,"PF DeMarcus Cousins C Anthony Davis G Donovan Mitchell UTIL Taj Gibson SG Joe Ingles SF Lance Stephenson PG Alec Burks F Andre Roberson",NA,"","","",NA
1082,940243026,"sasmallen (11/20)",0,259.25,"SF Kevin Durant PF Draymond Green SG Jimmy Butler PG Elfrid Payton G Jeremy Lamb UTIL Willie Cauley-Stein F Domantas Sabonis C Zaza Pachulia",NA,"","","",NA
1082,940243187,"viewfromtop (2/2)",0,259.25,"SF Kevin Durant PG Kyle Lowry UTIL Victor Oladipo C Dwight Howard PF Kelly Olynyk G Michael Carter-Williams F JaMychal Green SG Alec Burks",NA,"","","",NA
1082,940246943,"Millertime2057 (1/2)",0,259.25,"C LaMarcus Aldridge PG Victor Oladipo SF Carmelo Anthony PF Derrick Favors SG Avery Bradley UTIL Marcin Gortat F Joe Ingles G Buddy Hield",NA,"","","",NA
1082,940259652,"westy1322 (8/12)",0,259.25,"UTIL Andre Drummond SF Aaron Gordon C Nikola Vucevic PG Goran Dragic F Lauri Markkanen PF Zach Randolph G George Hill SG Garrett Temple",NA,"","","",NA
1082,940265564,"Britrubig21 (2/2)",0,259.25,"G Russell Westbrook SF Kevin Durant SG Klay Thompson UTIL Justin Holiday F Kelly Oubre Jr. PF Kelly Olynyk PG Tomas Satoransky C Zaza Pachulia",NA,"","","",NA
1082,940281484,"khay86 (11/20)",0,259.25,"C DeMarcus Cousins PG Kyle Lowry F Aaron Gordon UTIL Otto Porter SF Evan Fournier G Michael Carter-Williams SG Tomas Satoransky PF Marreese Speights",NA,"","","",NA
1082,940281489,"khay86 (16/20)",0,259.25,"C DeMarcus Cousins UTIL Kyle Lowry F Aaron Gordon PG Elfrid Payton SF Evan Fournier G Michael Carter-Williams SG Alec Burks PF Marreese Speights",NA,"","","",NA
1082,940287359,"nickpods (2/2)",0,259.25,"C Andre Drummond PG Kyle Lowry SG Victor Oladipo UTIL Dwight Howard F Kelly Oubre Jr. SF Lance Stephenson PF Kelly Olynyk G Tomas Satoransky",NA,"","","",NA
1098,939397179,"jabraun42 (1/5)",0,259,"PF DeMarcus Cousins C Andre Drummond SF Otto Porter PG Ricky Rubio SG Kelly Oubre Jr. G Jerian Grant F Kelly Olynyk UTIL Michael Kidd-Gilchrist",NA,"","","",NA
1098,939403519,"jabraun42 (2/5)",0,259,"PF DeMarcus Cousins C Andre Drummond SF Otto Porter PG Ricky Rubio SG Kelly Oubre Jr. G Jerian Grant F Kelly Olynyk UTIL Michael Kidd-Gilchrist",NA,"","","",NA
1098,939542460,"Purplepain777 (4/4)",0,259,"C Andre Drummond SG Bradley Beal SF Aaron Gordon UTIL Nikola Vucevic PF Otto Porter F Kelly Oubre Jr. PG Alec Burks G Fred VanVleet",NA,"","","",NA
1098,939713485,"oneandonlydebo (1/2)",0,259,"F LaMarcus Aldridge SF Aaron Gordon C Nikola Vucevic PF Otto Porter PG Elfrid Payton UTIL Marcin Gortat G Kelly Oubre Jr. SG Tomas Satoransky",NA,"","","",NA
1098,939867639,"buckstratford (2/20)",0,259,"SF Kevin Durant PF Draymond Green SG Jimmy Butler C Nikola Vucevic UTIL Dion Waiters PG Michael Carter-Williams F Bam Adebayo G Alec Burks",NA,"","","",NA
1098,940039870,"mrblonde1425 (5/19)",0,259,"PG Victor Oladipo SG Bradley Beal PF Aaron Gordon C Dwight Howard SF Otto Porter G Michael Carter-Williams F Bam Adebayo UTIL Justise Winslow",NA,"","","",NA
1098,940056787,"vandy2bid",0,259,"PG Russell Westbrook C Karl-Anthony Towns UTIL Elfrid Payton G Ricky Rubio PF Willie Cauley-Stein SF Joe Ingles F Kelly Olynyk SG Alec Burks",NA,"","","",NA
1098,940084375,"wideleftskol (6/7)",0,259,"C Marc Gasol SG Jimmy Butler SF Carmelo Anthony UTIL Otto Porter F Derrick Favors PG Elfrid Payton PF Willie Cauley-Stein G Raymond Felton",NA,"","","",NA
1098,940113186,"mosyadig (7/20)",0,259,"F Anthony Davis UTIL Kyle Lowry G Victor Oladipo C Nikola Vucevic SF Kelly Oubre Jr. PF Bam Adebayo PG Tomas Satoransky SG Alec Burks",NA,"","","",NA
1107,939365485,"dvbobos22",0,258.75,"UTIL LaMarcus Aldridge G Kyle Lowry SF Otto Porter C Derrick Favors PG Elfrid Payton PF James Johnson F Kelly Oubre Jr. SG Alec Burks",NA,"","","",NA
1107,939373598,"wentzyldelphia11",0,258.75,"SF Aaron Gordon PF Draymond Green SG Jimmy Butler UTIL Tyreke Evans F Otto Porter PG Elfrid Payton G De'Aaron Fox C Gorgui Dieng",NA,"","","",NA
1107,939407307,"JimmyZim620",0,258.75,"G Kyle Lowry C Marc Gasol UTIL Goran Dragic SG Donovan Mitchell F Otto Porter SF Evan Fournier PG Michael Carter-Williams PF Frank Kaminsky",NA,"","","",NA
1107,939443217,"TimberKing721",0,258.75,"C Anthony Davis UTIL LaMarcus Aldridge SF Paul George G Jrue Holiday PF Kelly Olynyk PG Michael Carter-Williams F Bam Adebayo SG Tomas Satoransky",NA,"","","",NA
1107,939469658,"mikiamit (19/20)",0,258.75,"G Stephen Curry UTIL Kyle Lowry F Draymond Green SF Tyreke Evans SG Donovan Mitchell C Frank Kaminsky PF Omri Casspi PG Alec Burks",NA,"","","",NA
1107,939663832,"blitzology (16/20)",0,258.75,"F DeMarcus Cousins SF Aaron Gordon PG Elfrid Payton PF Lauri Markkanen UTIL Steven Adams SG Evan Fournier C Kelly Olynyk G Frank Mason III",NA,"","","",NA
1107,939809602,"I-HATE-PANTS (11/20)",0,258.75,"G Russell Westbrook SF Paul George C Marc Gasol UTIL Tobias Harris F Kelly Olynyk PG Michael Carter-Williams PF Pascal Siakam SG Andre Roberson",NA,"","","",NA
1107,939814921,"Skadoosh (10/20)",0,258.75,"G Russell Westbrook C Andre Drummond PF Lauri Markkanen UTIL Taj Gibson SF Jonathon Simmons F Kelly Olynyk PG Michael Carter-Williams SG Alec Burks",NA,"","","",NA
1107,939867652,"buckstratford (15/20)",0,258.75,"PG Russell Westbrook SG Jimmy Butler UTIL Derrick Favors C Pau Gasol SF Jeremy Lamb PF Domantas Sabonis F Bam Adebayo G Alec Burks",NA,"","","",NA
1107,939977430,"SGdennis85 (1/3)",0,258.75,"PF DeMarcus Cousins G Kyle Lowry SF Otto Porter UTIL Ricky Rubio F Zach Randolph SG Jonathon Simmons PG Michael Carter-Williams C Bam Adebayo",NA,"","","",NA
1107,940027379,"Billnap",0,258.75,"SF Kevin Durant C Andre Drummond UTIL Dwight Howard PF Draymond Green PG Ricky Rubio G Tomas Satoransky F Thabo Sefolosha SG Alec Burks",NA,"","","",NA
1107,940271620,"thoroughnut (17/20)",0,258.75,"G Victor Oladipo UTIL Nikola Vucevic SG Klay Thompson PG Jrue Holiday C Steven Adams F Jeremy Lamb PF Willie Cauley-Stein SF Kelly Oubre Jr.",NA,"","","",NA
1119,939317221,"Kolin1 (2/3)",0,258.5,"UTIL Russell Westbrook PG Kyle Lowry SF Otto Porter PF Lauri Markkanen C Willie Cauley-Stein F Kelly Olynyk G Michael Carter-Williams SG Alec Burks",NA,"","","",NA
1119,939347556,"CMORTON72 (7/20)",0,258.5,"SF Kevin Durant UTIL Marc Gasol G Goran Dragic SG Klay Thompson PG Elfrid Payton C Robin Lopez F Bam Adebayo PF Jakob Poeltl",NA,"","","",NA
1119,939741830,"twheat1 (7/7)",0,258.5,"PG Russell Westbrook C Andre Drummond G Kris Dunn SF Denzel Valentine F Joe Ingles SG Kelly Oubre Jr. UTIL Michael Carter-Williams PF Marvin Williams",NA,"","","",NA
1119,939786773,"surajdave (18/20)",0,258.5,"SG Stephen Curry PF Kevin Durant UTIL Donovan Mitchell G Ricky Rubio SF Evan Fournier PG Michael Carter-Williams F JaMychal Green C Bam Adebayo",NA,"","","",NA
1119,939908896,"Jakehunter (2/20)",0,258.5,"UTIL Stephen Curry C Karl-Anthony Towns SG Donovan Mitchell G Elfrid Payton F Lauri Markkanen PG Michael Carter-Williams SF JaMychal Green PF Bam Adebayo",NA,"","","",NA
1119,940001564,"slipperywhendry (15/20)",0,258.5,"G Kyle Lowry PG Victor Oladipo PF Aaron Gordon UTIL Dwight Howard SF Otto Porter C Robin Lopez SG Stanley Johnson F Andre Roberson",NA,"","","",NA
1119,940001565,"slipperywhendry (16/20)",0,258.5,"G Kyle Lowry PG Victor Oladipo PF Aaron Gordon UTIL Dwight Howard SF Otto Porter C Robin Lopez F Stanley Johnson SG Andre Roberson",NA,"","","",NA
1119,940103814,"Roddizog (1/3)",0,258.5,"PG Russell Westbrook SG Jimmy Butler F Derrick Favors C Myles Turner G Ricky Rubio PF Serge Ibaka SF JaMychal Green UTIL Alec Burks",NA,"","","",NA
1119,940203153,"laces.out.dan (5/8)",0,258.5,"C Karl-Anthony Towns SF Paul George SG Jimmy Butler G Avery Bradley PG Ricky Rubio PF Domantas Sabonis F Serge Ibaka UTIL George Hill",NA,"","","",NA
1119,940226787,"twistedtim1",0,258.5,"PG Stephen Curry PF LaMarcus Aldridge SG Victor Oladipo SF Nicolas Batum G Bojan Bogdanovic UTIL De'Aaron Fox F Michael Kidd-Gilchrist C Bam Adebayo",NA,"","","",NA
1119,940248129,"m4ch1n3m4n (2/2)",0,258.5,"C Karl-Anthony Towns PG Kyle Lowry UTIL Marc Gasol PF Lauri Markkanen SG Nicolas Batum SF Markieff Morris F Kelly Olynyk G Michael Carter-Williams",NA,"","","",NA
1119,940253363,"kdnez (2/2)",0,258.5,"PF DeMarcus Cousins C Andre Drummond G Jeff Teague PG Elfrid Payton SG Joe Ingles UTIL Michael Carter-Williams SF JaMychal Green F Bam Adebayo",NA,"","","",NA
1119,940295803,"Cehbeen91 (1/2)",0,258.5,"PG Russell Westbrook SG Klay Thompson PF Lauri Markkanen C Steven Adams F Thaddeus Young G Evan Fournier UTIL Kelly Olynyk SF Michael Kidd-Gilchrist",NA,"","","",NA
1119,940309379,"mcboom",0,258.5,"G Russell Westbrook F Aaron Gordon C Dwight Howard PF James Johnson SF Jeremy Lamb PG Michael Carter-Williams UTIL Tomas Satoransky SG Alec Burks",NA,"","","",NA
1133,939162071,"SlowQueen (1/20)",0,258.25,"SG Stephen Curry F Paul George C Marc Gasol SF Tyreke Evans UTIL Willie Cauley-Stein PG Tyler Johnson G Stanley Johnson PF Marvin Williams",NA,"","","",NA
1133,939241867,"thisbs (1/3)",0,258.25,"UTIL Andre Drummond C Marc Gasol PG Goran Dragic SG Donovan Mitchell SF Otto Porter PF Willie Cauley-Stein F Kelly Oubre Jr. G Reggie Bullock",NA,"","","",NA
1133,939327298,"gundacker (6/20)",0,258.25,"C Karl-Anthony Towns PF LaMarcus Aldridge PG Kyle Lowry SG Victor Oladipo F Kyle Anderson SF JaMychal Green G Alec Burks UTIL Jakob Poeltl",NA,"","","",NA
1133,939327302,"gundacker (10/20)",0,258.25,"PG Russell Westbrook C Karl-Anthony Towns SF Paul George PF Carmelo Anthony F JaMychal Green G Frank Mason III SG Alec Burks UTIL Jakob Poeltl",NA,"","","",NA
1133,939380643,"GooDucks541 (6/7)",0,258.25,"PG Russell Westbrook C LaMarcus Aldridge F Paul George UTIL James Johnson SF Lance Stephenson PF Pascal Siakam G Tomas Satoransky SG Alec Burks",NA,"","","",NA
1133,939452140,"oxenduck (16/20)",0,258.25,"F Paul George PG Kyle Lowry SF Aaron Gordon C Nikola Vucevic UTIL Carmelo Anthony G Michael Carter-Williams PF Bam Adebayo SG Alec Burks",NA,"","","",NA
1133,939814916,"Skadoosh (5/20)",0,258.25,"SG Stephen Curry G Jimmy Butler PF Lauri Markkanen F Justin Holiday UTIL Steven Adams C Taj Gibson SF Jonathon Simmons PG Michael Carter-Williams",NA,"","","",NA
1133,939867641,"buckstratford (4/20)",0,258.25,"SF Kevin Durant PF Draymond Green SG Jimmy Butler C Nikola Vucevic UTIL Kris Dunn PG Michael Carter-Williams F Bam Adebayo G Alec Burks",NA,"","","",NA
1133,939976584,"mbperalt2012 (6/20)",0,258.25,"SG Stephen Curry PF Aaron Gordon F Otto Porter PG Elfrid Payton SF Denzel Valentine UTIL Ricky Rubio C Kelly Olynyk G Tomas Satoransky",NA,"","","",NA
1133,939997914,"savidgebeast (6/20)",0,258.25,"PG Kyle Lowry SG Victor Oladipo C Dwight Howard PF Draymond Green G Kyle Anderson UTIL Zach Randolph F Lance Stephenson SF Wayne Ellington",NA,"","","",NA
1133,940272058,"t5662jp (5/20)",0,258.25,"UTIL Karl-Anthony Towns SF Paul George C Dwight Howard G Ricky Rubio SG Evan Fournier PF Willie Cauley-Stein F Serge Ibaka PG Michael Carter-Williams",NA,"","","",NA
1133,940301906,"jdezzie383 (3/4)",0,258.25,"PG Victor Oladipo G Tyreke Evans PF Carmelo Anthony SF Otto Porter UTIL James Johnson C Steven Adams SG Jeremy Lamb F Josh Richardson",NA,"","","",NA
1145,939305029,"LouJay",0,258,"PG Russell Westbrook SG Victor Oladipo PF Aaron Gordon C Nikola Vucevic UTIL Lance Stephenson F Frank Kaminsky SF Omri Casspi G Alec Burks",NA,"","","",NA
1145,939654998,"lionssuck (1/2)",0,258,"C Karl-Anthony Towns PG Kyle Lowry G Donovan Mitchell PF Tobias Harris UTIL Myles Turner SF Nicolas Batum F Kelly Olynyk SG Alec Burks",NA,"","","",NA
1145,939746374,"primetime20769 (3/4)",0,258,"PG Stephen Curry UTIL Paul George SF Tobias Harris G Elfrid Payton PF Lauri Markkanen C Steven Adams F JaMychal Green SG Andre Roberson",NA,"","","",NA
1145,939908895,"Jakehunter (1/20)",0,258,"UTIL Stephen Curry C Karl-Anthony Towns G Donovan Mitchell PF Lauri Markkanen F Rodney Hood SF Joe Ingles PG Michael Carter-Williams SG Garrett Temple",NA,"","","",NA
1145,939911669,"emeyer001",0,258,"G Stephen Curry PF Draymond Green C Nikola Vucevic PG Elfrid Payton SF Evan Fournier SG Jonathon Simmons F Kelly Olynyk UTIL Michael Carter-Williams",NA,"","","",NA
1145,940049217,"ZENSTER (12/18)",0,258,"UTIL Stephen Curry PG Kyle Lowry PF Carmelo Anthony SF Otto Porter C Steven Adams G Tyus Jones F Markieff Morris SG Alec Burks",NA,"","","",NA
1145,940195622,"WarriorKid15 (2/5)",0,258,"SF Kevin Durant UTIL Andre Drummond SG Tyreke Evans C Steven Adams PG Ricky Rubio PF Zach Randolph G Michael Carter-Williams F Stanley Johnson",NA,"","","",NA
1145,940235374,"aengel927 (5/9)",0,258,"F Anthony Davis SG Victor Oladipo C Dwight Howard PG Kris Dunn PF Lauri Markkanen UTIL Michael Carter-Williams SF Jonas Jerebko G Alec Burks",NA,"","","",NA
1145,940236869,"Icon52085 (11/13)",0,258,"SF Kevin Durant PF LaMarcus Aldridge SG Jimmy Butler C Myles Turner PG Ricky Rubio F Serge Ibaka G Tim Frazier UTIL Alec Burks",NA,"","","",NA
1145,940245845,"VinnyVampire",0,258,"SG Stephen Curry C LaMarcus Aldridge F Tobias Harris G Elfrid Payton PG Reggie Jackson UTIL Zach Randolph SF Michael Kidd-Gilchrist PF Marvin Williams",NA,"","","",NA
1145,940282965,"orlandoj (3/8)",0,258,"PG Stephen Curry SF Paul George C Dwight Howard PF Carmelo Anthony G Elfrid Payton F Michael Kidd-Gilchrist SG Frank Mason III UTIL Alec Burks",NA,"","","",NA
1145,940294846,"haucks4him (1/4)",0,258,"UTIL DeMarcus Cousins C Marc Gasol SF Otto Porter PF Taj Gibson PG Ricky Rubio SG Jonathon Simmons F Serge Ibaka G Alec Burks",NA,"","","",NA
1157,939430803,"eckoplatinum (2/20)",0,257.75,"PG Stephen Curry SF Kevin Durant PF Draymond Green SG Klay Thompson C Kelly Olynyk UTIL Michael Carter-Williams F Dillon Brooks G Andre Roberson",NA,"","","",NA
1157,939460415,"wdoubleuw (14/20)",0,257.75,"SF Paul George G Kyle Lowry C Dwight Howard SG Jimmy Butler UTIL Steven Adams F Bojan Bogdanovic PG Michael Carter-Williams PF Bam Adebayo",NA,"","","",NA
1157,939469643,"mikiamit (4/20)",0,257.75,"UTIL Stephen Curry C Marc Gasol SF Tyreke Evans G Donovan Mitchell F Derrick Favors SG Tyus Jones PF Frank Kaminsky PG Alec Burks",NA,"","","",NA
1157,939533074,"rd1988 (10/10)",0,257.75,"PG Kyle Lowry G Victor Oladipo SG DeMar DeRozan UTIL Thaddeus Young SF Evan Fournier C Domantas Sabonis F Jonathon Simmons PF Pascal Siakam",NA,"","","",NA
1157,939746722,"gavin99w",0,257.75,"UTIL Russell Westbrook F Paul George G Elfrid Payton PF Lauri Markkanen SG Evan Fournier PG Michael Carter-Williams SF JaMychal Green C Bam Adebayo",NA,"","","",NA
1157,939811830,"tsi_xero",0,257.75,"PG Russell Westbrook G Kyle Lowry F Aaron Gordon SF Otto Porter PF Kelly Olynyk UTIL Michael Carter-Williams C Bam Adebayo SG Ben McLemore",NA,"","","",NA
1157,940023485,"SBlack15 (3/3)",0,257.75,"PF Anthony Davis UTIL Draymond Green PG Donovan Mitchell F Tobias Harris SG Evan Fournier SF Joe Ingles G Kelly Oubre Jr. C Bam Adebayo",NA,"","","",NA
1157,940084511,"baruch71189 (3/10)",0,257.75,"PF LaMarcus Aldridge PG Kyle Lowry SG Victor Oladipo UTIL Dwight Howard C Steven Adams SF Lance Stephenson F Norman Powell G Alec Burks",NA,"","","",NA
1157,940116168,"Shivacupholder (1/3)",0,257.75,"C DeMarcus Cousins G Kyle Lowry F Andrew Wiggins SF Otto Porter UTIL Domantas Sabonis PF Kelly Olynyk PG Michael Carter-Williams SG Alec Burks",NA,"","","",NA
1157,940125279,"RickFall28 (2/2)",0,257.75,"SF Paul George C Draymond Green G Jimmy Butler F Carmelo Anthony PG Elfrid Payton SG Jeremy Lamb PF Kelly Olynyk UTIL Frank Kaminsky",NA,"","","",NA
