"Rank","EntryId","EntryName","TimeRemaining","Points","Lineup","X","Player","Roster.Position","X.Drafted","FPTS"
1024,936882736,"donkosaurus (4/7)",0,209.5,"PF Kevin Durant G Spencer Dinwiddie PG Lonzo Ball SF Otto Porter UTIL Nicolas Batum SG Dennis Smith Jr. F J.J. Redick C Bam Adebayo",NA,"","","",NA
1024,936953954,"scout326 (7/20)",0,209.5,"C Andre Drummond PF Kristaps Porzingis G Spencer Dinwiddie UTIL Myles Turner F Harrison Barnes SG Caris LeVert SF Jonathon Simmons PG Michael Carter-Williams",NA,"","","",NA
1024,937297050,"petteytheft89 (2/24)",0,209.5,"F DeMarcus Cousins G Tyreke Evans UTIL Harrison Barnes SG Nicolas Batum PG Dennis Smith Jr. SF Evan Fournier C Steven Adams PF Marvin Williams",NA,"","","",NA
1024,937781563,"allabout3837 (17/41)",0,209.5,"SG James Harden C Karl-Anthony Towns SF Tyreke Evans UTIL Dennis Smith Jr. PG Rajon Rondo G Wesley Matthews PF Kelly Olynyk F Pascal Siakam",NA,"","","",NA
1028,937054055,"brianlefevre (22/25)",0,209.25,"C Marc Gasol F Kristaps Porzingis PG Kyle Lowry SF Harrison Barnes SG Dennis Smith Jr. PF Dirk Nowitzki UTIL Wesley Matthews G Caris LeVert",NA,"","","",NA
1028,937054419,"rikkidee (25/25)",0,209.25,"UTIL Anthony Davis SG Chris Paul C Myles Turner PF James Johnson PG Elfrid Payton G Wesley Matthews F Kelly Olynyk SF Michael Kidd-Gilchrist",NA,"","","",NA
1028,937105055,"bw5126 (8/41)",0,209.25,"C Andre Drummond PF Kristaps Porzingis UTIL Clint Capela SF Harrison Barnes SG Dennis Smith Jr. F Trevor Booker PG Jarrett Jack G Michael Carter-Williams",NA,"","","",NA
1028,937171331,"cheddabisque (24/41)",0,209.25,"F Kristaps Porzingis SG Bradley Beal C Nikola Vucevic PF Pau Gasol PG Elfrid Payton UTIL Trevor Booker G Wesley Matthews SF Caris LeVert",NA,"","","",NA
1032,936956387,"moklovin (16/20)",0,209,"PG Russell Westbrook C Andre Drummond UTIL Kristaps Porzingis F Harrison Barnes G Michael Carter-Williams PF Pascal Siakam SF Marvin Williams SG Sean Kilpatrick",NA,"","","",NA
1032,937054019,"brianlefevre (1/25)",0,209,"PG James Harden PF Kristaps Porzingis SF Harrison Barnes SG Dennis Smith Jr. C Dirk Nowitzki UTIL Wesley Matthews G Caris LeVert F JaMychal Green",NA,"","","",NA
1034,937167910,"CHaufff",0,208.75,"UTIL James Harden PF Kristaps Porzingis F Tyreke Evans SF Harrison Barnes SG Dennis Smith Jr. G Jarrett Jack PG Michael Carter-Williams C Bam Adebayo",NA,"","","",NA
1035,936956385,"moklovin (14/20)",0,208.5,"PG Russell Westbrook PF Kristaps Porzingis SG Jimmy Butler SF Harrison Barnes C Steven Adams G Michael Carter-Williams F Pascal Siakam UTIL Sean Kilpatrick",NA,"","","",NA
1035,936960279,"pianoclub (32/41)",0,208.5,"G Russell Westbrook F Anthony Davis UTIL Steven Adams C Marcin Gortat SF Markieff Morris SG Tyus Jones PG Michael Carter-Williams PF Pascal Siakam",NA,"","","",NA
1035,936988681,"dthegrizzly",0,208.5,"C Kristaps Porzingis SG Bradley Beal PF Otto Porter SF Harrison Barnes PG Dennis Smith Jr. G Jeremy Lamb F Trevor Booker UTIL Courtney Lee",NA,"","","",NA
1035,937171345,"cheddabisque (38/41)",0,208.5,"G Russell Westbrook PF Kristaps Porzingis SF Harrison Barnes UTIL Evan Fournier F Trevor Booker C Marcin Gortat PG Rajon Rondo SG Stanley Johnson",NA,"","","",NA
1035,937228662,"seida (3/6)",0,208.5,"G Russell Westbrook UTIL Kristaps Porzingis SF Tobias Harris F Harrison Barnes C Steven Adams SG Jonathon Simmons PG Michael Carter-Williams PF Pascal Siakam",NA,"","","",NA
1035,937774032,"supertroopa22",0,208.5,"PG Russell Westbrook UTIL Kristaps Porzingis F Tobias Harris SF Harrison Barnes C Steven Adams SG Jonathon Simmons G Michael Carter-Williams PF Pascal Siakam",NA,"","","",NA
1035,937782125,"jatart (5/5)",0,208.5,"F Kevin Durant UTIL Andre Drummond SF Harrison Barnes SG Nicolas Batum PG Dennis Smith Jr. C Steven Adams G Wesley Matthews PF Pascal Siakam",NA,"","","",NA
1042,937228663,"seida (4/6)",0,208,"PG Russell Westbrook UTIL Kristaps Porzingis SG Spencer Dinwiddie F Nicolas Batum C Steven Adams G Caris LeVert SF Michael Kidd-Gilchrist PF Pascal Siakam",NA,"","","",NA
1042,937750592,"petteytheft89 (17/24)",0,208,"PF DeMarcus Cousins C Nikola Vucevic F Harrison Barnes SG Nicolas Batum UTIL Steven Adams G Eric Gordon PG Rajon Rondo SF Joe Harris",NA,"","","",NA
1044,936960267,"pianoclub (20/41)",0,207.75,"PF DeMarcus Cousins C Andre Drummond SF DeMarre Carroll UTIL Steven Adams F Trevor Booker G Rajon Rondo SG Jonathon Simmons PG Michael Carter-Williams",NA,"","","",NA
1044,937069403,"getoffme2312 (13/14)",0,207.75,"PF Anthony Davis C Marc Gasol G Tyreke Evans SG Dion Waiters UTIL Trevor Booker SF Caris LeVert PG Tyler Ulis F Dillon Brooks",NA,"","","",NA
1044,937166022,"youdacao (9/41)",0,207.75,"PG Russell Westbrook PF Kristaps Porzingis F Tyreke Evans SF Nicolas Batum SG Dennis Smith Jr. UTIL Joe Harris C Kelly Olynyk G Jarrett Jack",NA,"","","",NA
1044,937189273,"Kobe4MVP (25/41)",0,207.75,"PF DeMarcus Cousins UTIL Karl-Anthony Towns SG Jimmy Butler SF J.J. Redick C Trevor Booker F Wesley Matthews G Jarrett Jack PG Ish Smith",NA,"","","",NA
1044,937781584,"allabout3837 (38/41)",0,207.75,"PG Russell Westbrook F Kristaps Porzingis UTIL Bradley Beal G Kentavious Caldwell-Pope SF Nicolas Batum PF Pascal Siakam C Bam Adebayo SG Ben McLemore",NA,"","","",NA
1049,937054410,"rikkidee (16/25)",0,207.5,"PF Kristaps Porzingis C Nikola Vucevic SG Spencer Dinwiddie PG Lonzo Ball SF Otto Porter F Enes Kanter G Wesley Matthews UTIL Bam Adebayo",NA,"","","",NA
1049,937065858,"getoffme2312 (9/14)",0,207.5,"UTIL Karl-Anthony Towns PG Kyle Lowry G Devin Booker SG Tim Hardaway Jr. PF James Johnson F Jeremy Lamb SF Michael Kidd-Gilchrist C Bam Adebayo",NA,"","","",NA
1051,936840379,"Awesemo (10/41)",0,207.25,"C Joel Embiid F Kristaps Porzingis SG Jimmy Butler UTIL Myles Turner PG Dennis Smith Jr. G J.J. Barea PF Kelly Olynyk SF Stanley Johnson",NA,"","","",NA
1052,936956377,"moklovin (6/20)",0,207,"PG Russell Westbrook F Kristaps Porzingis SG Tyreke Evans C Steven Adams G Rajon Rondo UTIL Dirk Nowitzki SF Wesley Matthews PF Kelly Olynyk",NA,"","","",NA
1052,937753374,"papagates (6/25)",0,207,"UTIL DeMarcus Cousins C Joel Embiid PF Kristaps Porzingis F Harrison Barnes SF JaMychal Green G Sean Kilpatrick PG Cory Joseph SG Andre Roberson",NA,"","","",NA
1054,937054406,"rikkidee (12/25)",0,206.75,"SG James Harden UTIL Kristaps Porzingis PG Lonzo Ball PF James Johnson F Greg Monroe G Wesley Matthews SF JaMychal Green C Bam Adebayo",NA,"","","",NA
1054,937122201,"Rotomania (2/5)",0,206.75,"UTIL Anthony Davis C Marc Gasol G Tyreke Evans SG Dennis Smith Jr. SF Jeremy Lamb F Trevor Booker PF Kelly Olynyk PG Jarrett Jack",NA,"","","",NA
1054,937171330,"cheddabisque (23/41)",0,206.75,"C Andre Drummond G Bradley Beal UTIL Nikola Vucevic SG Tim Hardaway Jr. SF J.J. Redick PF Dirk Nowitzki F Courtney Lee PG Jarrett Jack",NA,"","","",NA
1054,937189265,"Kobe4MVP (17/41)",0,206.75,"F DeMarcus Cousins UTIL Andre Drummond SG Jimmy Butler C Trevor Booker PG Rajon Rondo SF Wesley Matthews G Jarrett Jack PF Bam Adebayo",NA,"","","",NA
1054,937490658,"imnoone (3/3)",0,206.75,"PF DeMarcus Cousins SG Bradley Beal SF Tobias Harris PG Dennis Smith Jr. C Steven Adams G Wesley Matthews F Kelly Olynyk UTIL Michael Carter-Williams",NA,"","","",NA
1059,937105050,"bw5126 (3/41)",0,206.5,"F DeMarcus Cousins C Andre Drummond PF Kristaps Porzingis SF Caris LeVert SG Josh Richardson UTIL Kelly Olynyk PG Jarrett Jack G Michael Carter-Williams",NA,"","","",NA
1060,936703187,"ChipotleAddict (28/41)",0,206.25,"F DeMarcus Cousins PF Kristaps Porzingis SF Harrison Barnes PG Reggie Jackson UTIL Enes Kanter C Steven Adams SG Stanley Johnson G Sean Kilpatrick",NA,"","","",NA
1060,936703191,"ChipotleAddict (32/41)",0,206.25,"PF DeMarcus Cousins SG Stephen Curry UTIL Myles Turner G Dennis Smith Jr. C Steven Adams F JaMychal Green SF Michael Kidd-Gilchrist PG Sean Kilpatrick",NA,"","","",NA
1060,936960253,"pianoclub (6/41)",0,206.25,"C Anthony Davis UTIL Kristaps Porzingis SG Tyreke Evans F Harrison Barnes SF DeMarre Carroll G Tyus Jones PG Michael Carter-Williams PF Pascal Siakam",NA,"","","",NA
1060,936960281,"pianoclub (34/41)",0,206.25,"F Anthony Davis SG Bradley Beal UTIL Carmelo Anthony SF DeMarre Carroll C Enes Kanter G Jonathon Simmons PG Michael Carter-Williams PF Pascal Siakam",NA,"","","",NA
1060,937054401,"rikkidee (7/25)",0,206.25,"F Anthony Davis UTIL Joel Embiid SG Tim Hardaway Jr. C Steven Adams G Wesley Matthews SF JaMychal Green PF Kelly Olynyk PG Michael Carter-Williams",NA,"","","",NA
1060,937297060,"petteytheft89 (12/24)",0,206.25,"F DeMarcus Cousins C Nikola Vucevic UTIL Myles Turner SF Nicolas Batum PG Dennis Smith Jr. SG Evan Fournier PF Serge Ibaka G E'Twaun Moore",NA,"","","",NA
1060,937312594,"vadimjacob (1/3)",0,206.25,"PF DeMarcus Cousins C Karl-Anthony Towns SF Harrison Barnes G Nicolas Batum SG Dennis Smith Jr. UTIL Dirk Nowitzki PG Michael Carter-Williams F Bam Adebayo",NA,"","","",NA
1060,937318871,"vadimjacob (2/3)",0,206.25,"PF DeMarcus Cousins C Karl-Anthony Towns SF Harrison Barnes G Nicolas Batum SG Dennis Smith Jr. UTIL Dirk Nowitzki PG Michael Carter-Williams F Bam Adebayo",NA,"","","",NA
1060,937319905,"vadimjacob (3/3)",0,206.25,"PF DeMarcus Cousins C Karl-Anthony Towns SF Harrison Barnes G Nicolas Batum SG Dennis Smith Jr. UTIL Dirk Nowitzki PG Michael Carter-Williams F Bam Adebayo",NA,"","","",NA
1060,937735276,"Superstars92",0,206.25,"C Andre Drummond UTIL Kristaps Porzingis PF Draymond Green SF Harrison Barnes SG Nicolas Batum G J.J. Barea F Wesley Matthews PG Michael Carter-Williams",NA,"","","",NA
1070,937770652,"papagates (22/25)",0,206,"PF DeMarcus Cousins C Kristaps Porzingis UTIL Myles Turner SF Harrison Barnes PG Elfrid Payton SG Jonathon Simmons F JaMychal Green G Sean Kilpatrick",NA,"","","",NA
1071,936960274,"pianoclub (27/41)",0,205.5,"F DeMarcus Cousins UTIL Andre Drummond C Karl-Anthony Towns SF Jonathon Simmons SG Tyus Jones G Jarrett Jack PG Michael Carter-Williams PF Pascal Siakam",NA,"","","",NA
1071,937054415,"rikkidee (21/25)",0,205.5,"UTIL Kristaps Porzingis SG Chris Paul PF Otto Porter G Tyreke Evans PG Elfrid Payton C Enes Kanter SF Wesley Matthews F Michael Kidd-Gilchrist",NA,"","","",NA
1071,937122204,"Rotomania (5/5)",0,205.5,"C Marc Gasol PF Kristaps Porzingis SG Tyreke Evans SF Harrison Barnes PG Elfrid Payton F Jeremy Lamb UTIL Steven Adams G Wayne Ellington",NA,"","","",NA
1071,937320388,"RDRFN4LF",0,205.5,"UTIL DeMarcus Cousins PF Kristaps Porzingis SG Tyreke Evans SF Harrison Barnes G Dennis Smith Jr. F Caris LeVert PG Michael Carter-Williams C Bam Adebayo",NA,"","","",NA
1071,937781163,"gqinxs",0,205.5,"C DeMarcus Cousins PF Kristaps Porzingis F Tyreke Evans SF Harrison Barnes SG Dennis Smith Jr. G Caris LeVert PG Michael Carter-Williams UTIL Bam Adebayo",NA,"","","",NA
1076,936953958,"scout326 (11/20)",0,205.25,"UTIL Kevin Durant C Kristaps Porzingis SG Tyreke Evans F Harrison Barnes SF Nicolas Batum PG Dennis Smith Jr. G Caris LeVert PF Pascal Siakam",NA,"","","",NA
1076,936960268,"pianoclub (21/41)",0,205.25,"F Anthony Davis C Karl-Anthony Towns SG Tyreke Evans SF Harrison Barnes UTIL Trevor Booker G Rajon Rondo PG Michael Carter-Williams PF Pascal Siakam",NA,"","","",NA
1076,936995980,"CasBrM (11/25)",0,205.25,"PF DeMarcus Cousins F Otto Porter G Tim Hardaway Jr. SF Harrison Barnes PG Dennis Smith Jr. C Steven Adams SG Courtney Lee UTIL Pascal Siakam",NA,"","","",NA
1076,937499260,"REDCOAT85 (31/41)",0,205.25,"F DeMarcus Cousins C Andre Drummond PF Harrison Barnes SG Nicolas Batum UTIL Steven Adams G Wesley Matthews PG Jarrett Jack SF Marvin Williams",NA,"","","",NA
1076,937510411,"BrandonAdams (11/41)",0,205.25,"G Russell Westbrook PG Goran Dragic F Otto Porter SG Tim Hardaway Jr. C Steven Adams PF Trevor Booker SF Michael Kidd-Gilchrist UTIL Bam Adebayo",NA,"","","",NA
1076,937759833,"brianlefevre (25/25)",0,205.25,"C Andre Drummond PF Kristaps Porzingis F Tyreke Evans SF Harrison Barnes PG Reggie Jackson SG Dennis Smith Jr. UTIL Wesley Matthews G Ish Smith",NA,"","","",NA
1082,936995647,"IamPGM (3/7)",0,205,"F DeMarcus Cousins UTIL Andre Drummond SF Harrison Barnes G Dennis Smith Jr. C Steven Adams SG Wesley Matthews PG Michael Carter-Williams PF Pascal Siakam",NA,"","","",NA
1082,937073518,"lwyszynski4",0,205,"C DeMarcus Cousins PF Anthony Davis SF Andrew Wiggins G Wesley Matthews SG Jonathon Simmons F Kelly Olynyk PG Michael Carter-Williams UTIL Bam Adebayo",NA,"","","",NA
1082,937404198,"Broseidon13",0,205,"PG Stephen Curry PF Kristaps Porzingis F Tyreke Evans SF Harrison Barnes SG Dennis Smith Jr. C Steven Adams G J.J. Barea UTIL Ish Smith",NA,"","","",NA
1082,937479689,"dahladino (3/4)",0,205,"F DeMarcus Cousins C Andre Drummond SF Harrison Barnes G Dennis Smith Jr. UTIL Steven Adams SG Wesley Matthews PG Michael Carter-Williams PF Pascal Siakam",NA,"","","",NA
1086,937054038,"brianlefevre (14/25)",0,204.75,"C Andre Drummond F Kristaps Porzingis SF Harrison Barnes PG Elfrid Payton SG Dennis Smith Jr. G Jeremy Lamb PF Dirk Nowitzki UTIL Wesley Matthews",NA,"","","",NA
1087,937535531,"BrandonAdams (13/41)",0,204.5,"C Anthony Davis UTIL Karl-Anthony Towns SF Andrew Wiggins SG Nicolas Batum PF Trevor Booker PG Rajon Rondo G Michael Carter-Williams F Bam Adebayo",NA,"","","",NA
1087,937770642,"papagates (12/25)",0,204.5,"UTIL DeMarcus Cousins C Joel Embiid PF Kristaps Porzingis PG J.J. Barea SG Caris LeVert SF JaMychal Green F Pascal Siakam G Sean Kilpatrick",NA,"","","",NA
1087,937781562,"allabout3837 (16/41)",0,204.5,"PG James Harden UTIL Bradley Beal SF Tyreke Evans SG Dennis Smith Jr. G Rajon Rondo F Dirk Nowitzki PF Markieff Morris C Bam Adebayo",NA,"","","",NA
1090,937745817,"venga95",0,204.25,"C Kristaps Porzingis G Bradley Beal PF Otto Porter F Tyreke Evans SF Harrison Barnes UTIL Dennis Smith Jr. SG Tyus Jones PG Michael Carter-Williams",NA,"","","",NA
1091,936703189,"ChipotleAddict (30/41)",0,204,"SF Kevin Durant C Andre Drummond F Kristaps Porzingis UTIL Myles Turner SG Eric Gordon PF Kelly Olynyk PG Patty Mills G Sean Kilpatrick",NA,"","","",NA
1091,936956384,"moklovin (13/20)",0,204,"PG Russell Westbrook PF Kristaps Porzingis SF Tyreke Evans SG Nicolas Batum UTIL Rajon Rondo C Dirk Nowitzki F JaMychal Green G Jarrett Jack",NA,"","","",NA
1091,936960248,"pianoclub (1/41)",0,204,"F DeMarcus Cousins C Andre Drummond SF Tyreke Evans UTIL DeMarre Carroll G Rajon Rondo SG Jonathon Simmons PG Michael Carter-Williams PF Pascal Siakam",NA,"","","",NA
1091,937189260,"Kobe4MVP (12/41)",0,204,"C Andre Drummond G Jimmy Butler F Tyreke Evans SF Tobias Harris PG Dennis Smith Jr. PF Trevor Booker UTIL Marcin Gortat SG Wesley Matthews",NA,"","","",NA
1091,937492618,"REDCOAT85 (5/41)",0,204,"PG Russell Westbrook F Kristaps Porzingis SF Harrison Barnes SG Nicolas Batum C Steven Adams UTIL Dirk Nowitzki G Wesley Matthews PF Pascal Siakam",NA,"","","",NA
1091,937781548,"allabout3837 (2/41)",0,204,"PG James Harden PF Anthony Davis G Eric Gordon F Greg Monroe SG J.J. Barea UTIL Wesley Matthews SF Jonathon Simmons C Kelly Olynyk",NA,"","","",NA
1097,936954106,"underjones (7/15)",0,203.75,"PF DeMarcus Cousins C Karl-Anthony Towns SG Tyreke Evans UTIL DeMarre Carroll G Dennis Smith Jr. SF JaMychal Green PG Jarrett Jack F E'Twaun Moore",NA,"","","",NA
1097,937576035,"rsbathla (3/5)",0,203.75,"PG Russell Westbrook C DeMarcus Cousins UTIL Kristaps Porzingis SF JaMychal Green G Michael Carter-Williams F Pascal Siakam SG Sean Kilpatrick PF Bam Adebayo",NA,"","","",NA
1099,936960287,"pianoclub (40/41)",0,203.25,"F Anthony Davis C Karl-Anthony Towns SF DeMarre Carroll PF Enes Kanter UTIL Steven Adams G Rajon Rondo SG Joe Harris PG Michael Carter-Williams",NA,"","","",NA
1099,937266144,"twomindsbluff (6/10)",0,203.25,"C Marc Gasol F Kristaps Porzingis G Kyle Lowry SG Tyreke Evans PF Trevor Booker UTIL Marcin Gortat SF Bojan Bogdanovic PG Michael Carter-Williams",NA,"","","",NA
1101,936703167,"ChipotleAddict (8/41)",0,203,"C DeMarcus Cousins F Kristaps Porzingis UTIL Myles Turner PG Elfrid Payton SG Evan Fournier SF J.J. Redick PF Kelly Olynyk G Sean Kilpatrick",NA,"","","",NA
1101,936703178,"ChipotleAddict (19/41)",0,203,"F DeMarcus Cousins C Andre Drummond PF Kristaps Porzingis SF Harrison Barnes G Joe Harris UTIL Kelly Olynyk PG Sean Kilpatrick SG Andre Roberson",NA,"","","",NA
1101,937293578,"BattleTurtle",0,203,"C DeMarcus Cousins UTIL Kristaps Porzingis SG Jimmy Butler F Harrison Barnes G Dennis Smith Jr. SF Lance Stephenson PG Ish Smith PF Bam Adebayo",NA,"","","",NA
1101,937338689,"TheTakeOVER (3/3)",0,203,"UTIL Anthony Davis C Marc Gasol G Tyreke Evans PF Harrison Barnes SF DeMarre Carroll SG Jonathon Simmons PG Michael Carter-Williams F Bam Adebayo",NA,"","","",NA
1105,937054416,"rikkidee (22/25)",0,202.75,"F Anthony Davis C Marc Gasol UTIL LaMarcus Aldridge G Darren Collison SG Wesley Matthews SF JaMychal Green PG Michael Carter-Williams PF Bam Adebayo",NA,"","","",NA
1105,937105065,"bw5126 (18/41)",0,202.75,"PG Russell Westbrook F Kristaps Porzingis G Jimmy Butler C Myles Turner SG Nicolas Batum PF Marquese Chriss SF E'Twaun Moore UTIL Sean Kilpatrick",NA,"","","",NA
1105,937555169,"eafterhours",0,202.75,"PF Kristaps Porzingis SG Bradley Beal C Nikola Vucevic SF Robert Covington UTIL Elfrid Payton PG Dennis Smith Jr. G Danny Green F Kelly Olynyk",NA,"","","",NA
1108,936960263,"pianoclub (16/41)",0,202.5,"UTIL Andre Drummond C Karl-Anthony Towns G Bradley Beal SG Tyreke Evans F Trevor Booker SF Jonathon Simmons PG Michael Carter-Williams PF Pascal Siakam",NA,"","","",NA
1108,937105053,"bw5126 (6/41)",0,202.5,"G Russell Westbrook C Andre Drummond PF Kristaps Porzingis SF J.J. Redick F Joe Harris UTIL Michael Carter-Williams PG Ish Smith SG Sean Kilpatrick",NA,"","","",NA
1110,937065672,"getoffme2312 (3/14)",0,202,"C Andre Drummond UTIL Marc Gasol G Tyreke Evans F James Johnson PF DeMarre Carroll PG Dennis Smith Jr. SF Caris LeVert SG Sean Kilpatrick",NA,"","","",NA
1110,937470422,"thehyung",0,202,"UTIL Karl-Anthony Towns PF Kristaps Porzingis G Bradley Beal SG Tyreke Evans SF Dion Waiters F Kelly Oubre Jr. PG Michael Carter-Williams C Bam Adebayo",NA,"","","",NA
1110,937589057,"BrandonAdams (18/41)",0,202,"PG Russell Westbrook PF Kristaps Porzingis SF Otto Porter SG Dennis Smith Jr. C Steven Adams F Trevor Booker G Michael Carter-Williams UTIL Bam Adebayo",NA,"","","",NA
1110,937781578,"allabout3837 (32/41)",0,202,"PG Russell Westbrook PF Anthony Davis SG Dennis Smith Jr. SF Markieff Morris C Greg Monroe G Wesley Matthews F JaMychal Green UTIL Dillon Brooks",NA,"","","",NA
1114,936960255,"pianoclub (8/41)",0,201.75,"C Karl-Anthony Towns G Bradley Beal UTIL Carmelo Anthony SG Tyreke Evans SF Harrison Barnes PG Rajon Rondo F Markieff Morris PF Pascal Siakam",NA,"","","",NA
1114,937166054,"youdacao (41/41)",0,201.75,"SF Kevin Durant UTIL Marc Gasol G Chris Paul PG Spencer Dinwiddie C Steven Adams SG Jonathon Simmons PF Pascal Siakam F Bam Adebayo",NA,"","","",NA
1116,936914089,"gosixersgo76 (10/12)",0,201.5,"F Anthony Davis C Dwight Howard SG Tyreke Evans PF Harrison Barnes SF Nicolas Batum G Rajon Rondo UTIL Jonathon Simmons PG Michael Carter-Williams",NA,"","","",NA
1116,936960288,"pianoclub (41/41)",0,201.5,"F DeMarcus Cousins C Karl-Anthony Towns SG Bradley Beal SF DeMarre Carroll PG Rajon Rondo G Jarrett Jack PF Pascal Siakam UTIL Bam Adebayo",NA,"","","",NA
1116,937054028,"brianlefevre (9/25)",0,201.5,"PG Stephen Curry PF Kristaps Porzingis F Tobias Harris SF Harrison Barnes SG Dennis Smith Jr. C Dirk Nowitzki UTIL Wesley Matthews G Caris LeVert",NA,"","","",NA
1116,937603622,"maithienan2012 (3/3)",0,201.5,"G Russell Westbrook UTIL Andre Drummond PF Kristaps Porzingis SF Robert Covington PG Michael Carter-Williams F Pascal Siakam SG Sean Kilpatrick C Bam Adebayo",NA,"","","",NA
1120,936904820,"Msteinberg09",0,201.25,"C Joel Embiid UTIL Kristaps Porzingis F Tobias Harris PF Harrison Barnes SG Nicolas Batum G Dennis Smith Jr. SF JaMychal Green PG Sean Kilpatrick",NA,"","","",NA
1120,936960265,"pianoclub (18/41)",0,201.25,"PG Russell Westbrook UTIL Anthony Davis SG Tyreke Evans C Steven Adams G Jonathon Simmons SF Michael Kidd-Gilchrist PF Pascal Siakam F Bam Adebayo",NA,"","","",NA
1120,937430560,"hettingd",0,201.25,"C Andre Drummond UTIL Jimmy Butler SF Otto Porter G Tyreke Evans PF Harrison Barnes PG Dennis Smith Jr. SG Jonathon Simmons F Bam Adebayo",NA,"","","",NA
1123,937054022,"brianlefevre (4/25)",0,201,"C DeMarcus Cousins F Kristaps Porzingis SF Harrison Barnes PG Reggie Jackson SG Dennis Smith Jr. PF Dirk Nowitzki UTIL Wesley Matthews G Ish Smith",NA,"","","",NA
1124,936995972,"CasBrM (3/25)",0,200.75,"UTIL Marc Gasol SG Chris Paul G Spencer Dinwiddie SF Nicolas Batum PG Dennis Smith Jr. C Steven Adams PF Trevor Booker F Dirk Nowitzki",NA,"","","",NA
1124,937004542,"mikeg000 (1/3)",0,200.75,"C Andre Drummond PF Kristaps Porzingis SF T.J. Warren SG Tyreke Evans F Harrison Barnes PG Tyus Jones G Michael Carter-Williams UTIL Bam Adebayo",NA,"","","",NA
1124,937186677,"jilesofthetrees",0,200.75,"C DeMarcus Cousins UTIL Andre Drummond SG Bradley Beal SF Markieff Morris F Caris LeVert G Tim Frazier PG Michael Carter-Williams PF Bam Adebayo",NA,"","","",NA
1127,937492614,"REDCOAT85 (1/41)",0,200.5,"C Andre Drummond UTIL Marc Gasol SF Tyreke Evans F Harrison Barnes SG Nicolas Batum PG Dennis Smith Jr. G Wesley Matthews PF Pascal Siakam",NA,"","","",NA
1128,936857190,"Dikembe1",0,200.25,"PG Russell Westbrook C Karl-Anthony Towns SG Jimmy Butler PF Dirk Nowitzki SF Wesley Matthews G T.J. McConnell F Jonathon Simmons UTIL Michael Carter-Williams",NA,"","","",NA
1128,937166046,"youdacao (33/41)",0,200.25,"PF Kevin Durant C Kristaps Porzingis SG Jimmy Butler SF Tyreke Evans UTIL Dennis Smith Jr. F Caris LeVert PG Jarrett Jack G Michael Carter-Williams",NA,"","","",NA
1128,937531346,"benjihogan (1/2)",0,200.25,"G Russell Westbrook F Kristaps Porzingis UTIL Kyle Lowry C Brook Lopez PG J.J. Barea SG Wesley Matthews SF Jonathon Simmons PF Pascal Siakam",NA,"","","",NA
1128,937781550,"allabout3837 (4/41)",0,200.25,"PG James Harden C Anthony Davis G Jeremy Lamb UTIL Eric Gordon SG J.J. Barea SF Jonathon Simmons F JaMychal Green PF Bam Adebayo",NA,"","","",NA
1132,936953951,"scout326 (4/20)",0,200,"C Kristaps Porzingis PG Chris Paul F Tyreke Evans SF Tim Hardaway Jr. UTIL Myles Turner PF Harrison Barnes G Caris LeVert SG Sean Kilpatrick",NA,"","","",NA
1132,937499270,"REDCOAT85 (41/41)",0,200,"C Andre Drummond F Kristaps Porzingis UTIL Nikola Vucevic PF Harrison Barnes SG Nicolas Batum G Wesley Matthews SF Caris LeVert PG Michael Carter-Williams",NA,"","","",NA
1134,936960257,"pianoclub (10/41)",0,199.75,"C Andre Drummond F Kristaps Porzingis SG Bradley Beal SF DeMarre Carroll UTIL Enes Kanter G Rajon Rondo PG Michael Carter-Williams PF Pascal Siakam",NA,"","","",NA
1134,937043386,"EmileHeskey (2/41)",0,199.75,"C Joel Embiid F Kristaps Porzingis PF Harrison Barnes PG Reggie Jackson G Dennis Smith Jr. UTIL Steven Adams SG Jonathon Simmons SF Joe Harris",NA,"","","",NA
1134,937770643,"papagates (13/25)",0,199.75,"C Joel Embiid F Kevin Durant PF Kristaps Porzingis UTIL Myles Turner G Jonathon Simmons SF JaMychal Green SG Stanley Johnson PG Sean Kilpatrick",NA,"","","",NA
1137,936855473,"EmpireMaker2",0,199.5,"C Andre Drummond PF Kristaps Porzingis SG Tyreke Evans SF Harrison Barnes G Dennis Smith Jr. UTIL Steven Adams F Caris LeVert PG Michael Carter-Williams",NA,"","","",NA
1137,937286029,"Shooter-McGavin (3/3)",0,199.5,"PF Kristaps Porzingis PG Kyle Lowry SG Jimmy Butler SF Otto Porter F Tyreke Evans C Steven Adams G Jarrett Jack UTIL Bam Adebayo",NA,"","","",NA
1139,937189284,"Kobe4MVP (36/41)",0,199.25,"C Marc Gasol UTIL Kristaps Porzingis SG Bradley Beal PG Elfrid Payton G Evan Fournier PF Trevor Booker F Wesley Matthews SF JaMychal Green",NA,"","","",NA
1139,937332963,"TheTakeOVER (1/3)",0,199.25,"UTIL Anthony Davis C Marc Gasol G Tyreke Evans PF Harrison Barnes SF DeMarre Carroll SG Jonathon Simmons PG Jarrett Jack F Bam Adebayo",NA,"","","",NA
1141,936960278,"pianoclub (31/41)",0,199,"F Anthony Davis SF Carmelo Anthony SG Tyreke Evans PF Enes Kanter UTIL Steven Adams C Marcin Gortat G Rajon Rondo PG Michael Carter-Williams",NA,"","","",NA
1141,937160528,"PetrGibbons (15/20)",0,199,"C Andre Drummond PF Kristaps Porzingis UTIL Clint Capela F Tyreke Evans SG Courtney Lee G Bojan Bogdanovic PG J.J. Barea SF Jonathon Simmons",NA,"","","",NA
1143,937054399,"rikkidee (5/25)",0,198.75,"C Marc Gasol SG Chris Paul G Jimmy Butler PF James Johnson PG Elfrid Payton UTIL Steven Adams SF Wesley Matthews F Michael Kidd-Gilchrist",NA,"","","",NA
1143,937676370,"nickq4780 (2/2)",0,198.75,"C Anthony Davis UTIL Andre Drummond PF Tobias Harris G Reggie Jackson SG J.J. Redick PG J.J. Barea SF Norman Powell F Marquese Chriss",NA,"","","",NA
1145,936703161,"ChipotleAddict (2/41)",0,198.5,"PF DeMarcus Cousins C Kristaps Porzingis UTIL Myles Turner SF Harrison Barnes SG Nicolas Batum F Dirk Nowitzki PG Patty Mills G Sean Kilpatrick",NA,"","","",NA
1145,937003908,"agreen861 (4/4)",0,198.5,"PF DeMarcus Cousins F Anthony Davis C Steven Adams UTIL Larry Nance Jr. G Wesley Matthews PG Tyus Jones SF Lance Stephenson SG Dillon Brooks",NA,"","","",NA
1145,937171339,"cheddabisque (32/41)",0,198.5,"PG Russell Westbrook PF Kristaps Porzingis C Nikola Vucevic SG Dennis Smith Jr. SF Evan Fournier G Jarrett Jack UTIL Michael Kidd-Gilchrist F Bam Adebayo",NA,"","","",NA
1148,937166018,"youdacao (5/41)",0,198.25,"F Kevin Durant PF Kristaps Porzingis SG Jimmy Butler UTIL Spencer Dinwiddie C Steven Adams SF JaMychal Green PG Jarrett Jack G Michael Carter-Williams",NA,"","","",NA
1148,937166020,"youdacao (7/41)",0,198.25,"PG Stephen Curry UTIL Marc Gasol PF Kristaps Porzingis SF Harrison Barnes SG Nicolas Batum G Caris LeVert F Pascal Siakam C Bam Adebayo",NA,"","","",NA
