"Rank","EntryId","EntryName","TimeRemaining","Points","Lineup","X","Player","Roster.Position","X.Drafted","FPTS"
634,937480102,"tj4ua",0,238.5,"UTIL DeMarcus Cousins C Andre Drummond F Carmelo Anthony SF Harrison Barnes SG Caris LeVert PF Kelly Olynyk PG Michael Carter-Williams G Sean Kilpatrick",NA,"","","",NA
634,937524215,"stonezone85",0,238.5,"PG James Harden C Andre Drummond PF Harrison Barnes G Nicolas Batum SF Wesley Matthews SG Caris LeVert F JaMychal Green UTIL Marvin Williams",NA,"","","",NA
640,936914090,"gosixersgo76 (11/12)",0,238.25,"UTIL Stephen Curry C Andre Drummond PF Harrison Barnes SF Nicolas Batum SG Dennis Smith Jr. F Trevor Booker G Caris LeVert PG Michael Carter-Williams",NA,"","","",NA
640,937105078,"bw5126 (31/41)",0,238.25,"C DeMarcus Cousins UTIL Stephen Curry PF Tobias Harris SG Avery Bradley F Caris LeVert SF Josh Richardson PG Ish Smith G Sean Kilpatrick",NA,"","","",NA
640,937361202,"mray6288 (2/3)",0,238.25,"PG Russell Westbrook UTIL Kristaps Porzingis SF Otto Porter PF Harrison Barnes SG J.J. Barea G Caris LeVert F JaMychal Green C Kelly Olynyk",NA,"","","",NA
640,937361203,"mray6288 (3/3)",0,238.25,"PG Russell Westbrook UTIL Kristaps Porzingis SF Otto Porter PF Harrison Barnes SG J.J. Barea G Caris LeVert F JaMychal Green C Kelly Olynyk",NA,"","","",NA
644,936960283,"pianoclub (36/41)",0,238,"C Andre Drummond G Bradley Beal UTIL Otto Porter SG Tyreke Evans SF DeMarre Carroll PF Enes Kanter PG Michael Carter-Williams F Bam Adebayo",NA,"","","",NA
644,937054046,"brianlefevre (18/25)",0,238,"UTIL Russell Westbrook C Kristaps Porzingis PF Harrison Barnes PG Reggie Jackson SG Dennis Smith Jr. F Wesley Matthews SF Caris LeVert G Ish Smith",NA,"","","",NA
644,937166015,"youdacao (2/41)",0,238,"PG Russell Westbrook C Kristaps Porzingis SG Jimmy Butler SF Harrison Barnes PF Trevor Booker F JaMychal Green G Michael Carter-Williams UTIL Bam Adebayo",NA,"","","",NA
647,937149014,"ragingphilip (2/2)",0,237.75,"PG Russell Westbrook C Andre Drummond SF Harrison Barnes UTIL Dennis Smith Jr. PF Trevor Booker F Dirk Nowitzki SG Wesley Matthews G Sean Kilpatrick",NA,"","","",NA
647,937152551,"mazwa (5/7)",0,237.75,"PG Russell Westbrook C Andre Drummond SF Harrison Barnes UTIL Dennis Smith Jr. PF Trevor Booker F Dirk Nowitzki SG Wesley Matthews G Sean Kilpatrick",NA,"","","",NA
647,937171312,"cheddabisque (5/41)",0,237.75,"UTIL Russell Westbrook C Andre Drummond PF Pau Gasol F Enes Kanter G Rajon Rondo SG Danny Green PG Tyler Johnson SF Stanley Johnson",NA,"","","",NA
647,937171335,"cheddabisque (28/41)",0,237.75,"PF DeMarcus Cousins G Bradley Beal F Pau Gasol SF Harrison Barnes UTIL Trevor Booker C Dirk Nowitzki SG Courtney Lee PG Jarrett Jack",NA,"","","",NA
647,937189282,"Kobe4MVP (34/41)",0,237.75,"UTIL Andre Drummond PG Kyle Lowry SG Jimmy Butler F Tyreke Evans SF Nicolas Batum C Trevor Booker G Jarrett Jack PF Pascal Siakam",NA,"","","",NA
647,937378451,"grtwhitehoop (2/2)",0,237.75,"PG James Harden C Andre Drummond SG Jimmy Butler SF Harrison Barnes UTIL Caris LeVert PF Pascal Siakam G Sean Kilpatrick F Bam Adebayo",NA,"","","",NA
653,937018368,"thejakelevy1230 (2/2)",0,237.5,"PG James Harden SG Victor Oladipo G Jimmy Butler PF Otto Porter UTIL Courtney Lee F Pascal Siakam SF Marvin Williams C Bam Adebayo",NA,"","","",NA
653,937171317,"cheddabisque (10/41)",0,237.5,"C Joel Embiid G Bradley Beal SG Jimmy Butler UTIL Nikola Vucevic F Trevor Booker SF Wesley Matthews PG Jarrett Jack PF Bam Adebayo",NA,"","","",NA
653,937507828,"Staneetanator (5/10)",0,237.5,"C DeMarcus Cousins SG Stephen Curry PF Harrison Barnes G Dennis Smith Jr. UTIL Bojan Bogdanovic SF Wesley Matthews F Kelly Oubre Jr. PG Michael Carter-Williams",NA,"","","",NA
653,937507951,"Staneetanator (6/10)",0,237.5,"C DeMarcus Cousins SG Stephen Curry PF Harrison Barnes G Dennis Smith Jr. UTIL Bojan Bogdanovic SF Wesley Matthews F Kelly Oubre Jr. PG Michael Carter-Williams",NA,"","","",NA
653,937510585,"Staneetanator (7/10)",0,237.5,"C DeMarcus Cousins SG Stephen Curry PF Harrison Barnes G Dennis Smith Jr. UTIL Bojan Bogdanovic SF Wesley Matthews F Kelly Oubre Jr. PG Michael Carter-Williams",NA,"","","",NA
653,937781554,"allabout3837 (8/41)",0,237.5,"PG James Harden SG Bradley Beal SF Tyreke Evans F Jeremy Lamb PF Dirk Nowitzki C Greg Monroe G Jonathon Simmons UTIL Michael Carter-Williams",NA,"","","",NA
659,937171340,"cheddabisque (33/41)",0,237.25,"PG Russell Westbrook C Nikola Vucevic F Tobias Harris SF Tim Hardaway Jr. PF Trevor Booker UTIL Marcin Gortat SG Tyler Johnson G Jarrett Jack",NA,"","","",NA
659,937402657,"Rookie2442",0,237.25,"SF Kevin Durant G Chris Paul UTIL Draymond Green C Myles Turner SG Dennis Smith Jr. PG Rajon Rondo F Dirk Nowitzki PF Bam Adebayo",NA,"","","",NA
661,936704319,"sirmalcolm",0,237,"UTIL Russell Westbrook C DeMarcus Cousins SF Harrison Barnes G Dennis Smith Jr. F JaMychal Green PG Michael Carter-Williams PF Pascal Siakam SG Sean Kilpatrick",NA,"","","",NA
661,936956376,"moklovin (5/20)",0,237,"PG Russell Westbrook C DeMarcus Cousins F Harrison Barnes UTIL Dennis Smith Jr. SF JaMychal Green G Michael Carter-Williams PF Pascal Siakam SG Sean Kilpatrick",NA,"","","",NA
661,937213941,"yankeesfan2",0,237,"PG Russell Westbrook F LaMarcus Aldridge SF Tyreke Evans UTIL Steven Adams C Marcin Gortat PF Dirk Nowitzki SG Wesley Matthews G Dillon Brooks",NA,"","","",NA
661,937362719,"bquicksix (3/3)",0,237,"PF DeMarcus Cousins UTIL Bradley Beal G Tyreke Evans SF Harrison Barnes PG Dennis Smith Jr. SG Caris LeVert C Kelly Olynyk F Pascal Siakam",NA,"","","",NA
661,937610527,"CarrotBottom (2/2)",0,237,"G Stephen Curry C Andre Drummond SG Jimmy Butler SF Harrison Barnes F Trevor Booker UTIL Greg Monroe PF Pascal Siakam PG Sean Kilpatrick",NA,"","","",NA
661,937661809,"fjbourne (1/2)",0,237,"PG Russell Westbrook C DeMarcus Cousins SF Harrison Barnes SG Dennis Smith Jr. F JaMychal Green G Michael Carter-Williams PF Pascal Siakam UTIL Sean Kilpatrick",NA,"","","",NA
661,937768057,"BrandonAdams (36/41)",0,237,"UTIL Kristaps Porzingis SG Klay Thompson C Draymond Green PG Lonzo Ball SF Harrison Barnes PF Larry Nance Jr. G Jordan Clarkson F Pascal Siakam",NA,"","","",NA
661,937770647,"papagates (17/25)",0,237,"C Joel Embiid PF Kristaps Porzingis UTIL Myles Turner F Harrison Barnes SG Brandon Ingram G Dennis Smith Jr. SF JaMychal Green PG Sean Kilpatrick",NA,"","","",NA
661,937780687,"Stallion33 (2/2)",0,237,"PF DeMarcus Cousins G Stephen Curry SF Tyreke Evans UTIL Harrison Barnes SG Dennis Smith Jr. PG Ish Smith C Bam Adebayo F Jordan Bell",NA,"","","",NA
661,937781566,"allabout3837 (20/41)",0,237,"SG James Harden G Bradley Beal UTIL Harrison Barnes PG Dennis Smith Jr. SF Jeremy Lamb F Jonathon Simmons PF JaMychal Green C Kelly Olynyk",NA,"","","",NA
671,936868530,"scrawl",0,236.75,"UTIL James Harden C Andre Drummond SG Jimmy Butler SF Harrison Barnes PG Jarrett Jack G Michael Carter-Williams PF Pascal Siakam F Bam Adebayo",NA,"","","",NA
672,936840372,"Awesemo (3/41)",0,236.5,"C Joel Embiid PF Kristaps Porzingis PG Kyle Lowry UTIL Draymond Green SG Eric Gordon F Wesley Matthews SF Stanley Johnson G Fred VanVleet",NA,"","","",NA
672,937160527,"PetrGibbons (14/20)",0,236.5,"PG Russell Westbrook G Spencer Dinwiddie SG Tyreke Evans SF Tim Hardaway Jr. UTIL Dennis Smith Jr. C Dirk Nowitzki F Caris LeVert PF Pascal Siakam",NA,"","","",NA
672,937171327,"cheddabisque (20/41)",0,236.5,"UTIL Marc Gasol C Kristaps Porzingis F Draymond Green SF Tyreke Evans PF Harrison Barnes G Courtney Lee SG Caris LeVert PG Jarrett Jack",NA,"","","",NA
672,937427573,"Itachi16 (2/3)",0,236.5,"C DeMarcus Cousins G Chris Paul SG Tyreke Evans SF Harrison Barnes PG Dennis Smith Jr. F Trevor Booker PF Pascal Siakam UTIL Ish Smith",NA,"","","",NA
672,937730804,"BrandonAdams (24/41)",0,236.5,"PG Russell Westbrook C Andre Drummond SF Otto Porter SG Dennis Smith Jr. UTIL Larry Nance Jr. F Kelly Olynyk PF Pascal Siakam G Ish Smith",NA,"","","",NA
672,937781558,"allabout3837 (12/41)",0,236.5,"PG James Harden G Bradley Beal SG Tyreke Evans F Nicolas Batum UTIL Jeremy Lamb SF Wesley Matthews C Kelly Olynyk PF Bam Adebayo",NA,"","","",NA
678,937043387,"EmileHeskey (3/41)",0,236.25,"C Joel Embiid UTIL Nikola Vucevic F Tyreke Evans PG Reggie Jackson G Dennis Smith Jr. SF Jeremy Lamb PF Dirk Nowitzki SG Jonathon Simmons",NA,"","","",NA
678,937438093,"BrandonAdams (3/41)",0,236.25,"G James Harden PG Chris Paul C Myles Turner F Nicolas Batum SF Thaddeus Young SG Bojan Bogdanovic UTIL Michael Carter-Williams PF Bam Adebayo",NA,"","","",NA
678,937479946,"chess_is_ok",0,236.25,"PG Stephen Curry G Kyle Lowry UTIL Lonzo Ball PF Tobias Harris SG Nicolas Batum SF Larry Nance Jr. F Jonathon Simmons C Bam Adebayo",NA,"","","",NA
678,937481763,"smcguiga",0,236.25,"SG Bradley Beal PF Carmelo Anthony G Tyreke Evans C Myles Turner F Robert Covington SF Harrison Barnes PG Darren Collison UTIL Marvin Williams",NA,"","","",NA
678,937499258,"REDCOAT85 (29/41)",0,236.25,"C Andre Drummond SF Tyreke Evans PF Tobias Harris SG Tim Hardaway Jr. UTIL Harrison Barnes PG Reggie Jackson F Wesley Matthews G Caris LeVert",NA,"","","",NA
683,936953949,"scout326 (2/20)",0,236,"C Joel Embiid F Kevin Durant PF Harrison Barnes SF Nicolas Batum UTIL Dennis Smith Jr. SG Evan Fournier PG Michael Carter-Williams G Sean Kilpatrick",NA,"","","",NA
683,937105073,"bw5126 (26/41)",0,236,"C Andre Drummond UTIL LaMarcus Aldridge SF Carmelo Anthony PG Reggie Jackson SG Nicolas Batum F Domantas Sabonis G Joe Harris PF Kelly Olynyk",NA,"","","",NA
683,937160526,"PetrGibbons (13/20)",0,236,"PG Russell Westbrook F DeMarcus Cousins SG Tyreke Evans C Steven Adams UTIL Trevor Booker SF Marvin Williams PF Bam Adebayo G Cory Joseph",NA,"","","",NA
683,937171311,"cheddabisque (4/41)",0,236,"PG Russell Westbrook SG Jimmy Butler C Pau Gasol F Evan Fournier PF Trevor Booker UTIL Marcin Gortat G Courtney Lee SF Wesley Matthews",NA,"","","",NA
683,937225727,"cajunness",0,236,"C Kristaps Porzingis G Bradley Beal PG Kyle Lowry F Tim Hardaway Jr. PF Harrison Barnes SG Jeremy Lamb SF Kelly Oubre Jr. UTIL Bam Adebayo",NA,"","","",NA
683,937430458,"BrandonAdams (2/41)",0,236,"G Russell Westbrook F Kristaps Porzingis PG Lonzo Ball SG Avery Bradley C Dario Saric UTIL Trevor Booker SF Michael Kidd-Gilchrist PF Pascal Siakam",NA,"","","",NA
683,937636746,"Jaf0009",0,236,"UTIL James Harden C DeMarcus Cousins F Harrison Barnes SG Jeremy Lamb SF Michael Kidd-Gilchrist PG Michael Carter-Williams G Sean Kilpatrick PF Bam Adebayo",NA,"","","",NA
683,937781120,"dinod10215",0,236,"PG James Harden F Tyreke Evans SF Tobias Harris SG Tim Hardaway Jr. PF Harrison Barnes G Wesley Matthews UTIL Tyler Ulis C Bam Adebayo",NA,"","","",NA
691,936920117,"DaBramahBull (2/3)",0,235.75,"SG James Harden PF DeMarcus Cousins G Reggie Jackson UTIL Kentavious Caldwell-Pope F Michael Kidd-Gilchrist SF Stanley Johnson PG Michael Carter-Williams C Bam Adebayo",NA,"","","",NA
691,937033661,"dasb0609",0,235.75,"G Russell Westbrook UTIL Marc Gasol SG Chris Paul C Steven Adams F Dirk Nowitzki SF JaMychal Green PF Pascal Siakam PG Ish Smith",NA,"","","",NA
691,937105049,"bw5126 (2/41)",0,235.75,"C Joel Embiid F Kristaps Porzingis SG Tim Hardaway Jr. UTIL Myles Turner SF Harrison Barnes G Caris LeVert PF Kelly Olynyk PG Michael Carter-Williams",NA,"","","",NA
691,937498888,"REDCOAT85 (12/41)",0,235.75,"F DeMarcus Cousins C Andre Drummond SF Harrison Barnes SG Nicolas Batum UTIL Trevor Booker PG J.J. Barea G Caris LeVert PF Pascal Siakam",NA,"","","",NA
695,936914091,"gosixersgo76 (12/12)",0,235.5,"F DeMarcus Cousins SG Tyreke Evans UTIL Robert Covington PF Harrison Barnes SF Nicolas Batum C Steven Adams G Caris LeVert PG Michael Carter-Williams",NA,"","","",NA
695,936960270,"pianoclub (23/41)",0,235.5,"G Russell Westbrook F DeMarcus Cousins UTIL Enes Kanter C Steven Adams SG Jonathon Simmons SF Michael Kidd-Gilchrist PG Michael Carter-Williams PF Pascal Siakam",NA,"","","",NA
695,937350206,"DraftCheat (1/2)",0,235.5,"PF DeMarcus Cousins C Joel Embiid SF Harrison Barnes G Dennis Smith Jr. UTIL Steven Adams SG Wesley Matthews PG Ish Smith F Jordan Bell",NA,"","","",NA
695,937492616,"REDCOAT85 (3/41)",0,235.5,"C Andre Drummond SG Chris Paul SF Harrison Barnes PG Reggie Jackson F Enes Kanter G Dennis Smith Jr. UTIL Steven Adams PF Pascal Siakam",NA,"","","",NA
695,937576036,"rsbathla (4/5)",0,235.5,"PG Russell Westbrook C Kristaps Porzingis SG Jimmy Butler UTIL Harrison Barnes PF Greg Monroe SF JaMychal Green G Michael Carter-Williams F Pascal Siakam",NA,"","","",NA
695,937781560,"allabout3837 (14/41)",0,235.5,"PG James Harden G Bradley Beal SG Tyreke Evans F Jeremy Lamb C Steven Adams SF Bojan Bogdanovic PF JaMychal Green UTIL Bam Adebayo",NA,"","","",NA
701,936953955,"scout326 (8/20)",0,235.25,"C Andre Drummond SG Spencer Dinwiddie F Tyreke Evans UTIL Myles Turner PF Harrison Barnes SF Nicolas Batum G Rajon Rondo PG Michael Carter-Williams",NA,"","","",NA
701,936960260,"pianoclub (13/41)",0,235.25,"UTIL Russell Westbrook C Karl-Anthony Towns SG Tyreke Evans F Enes Kanter G Rajon Rondo SF Markieff Morris PG Michael Carter-Williams PF Pascal Siakam",NA,"","","",NA
701,937687165,"tombradyisgray (3/4)",0,235.25,"UTIL DeMarcus Cousins C Kristaps Porzingis F LaMarcus Aldridge SF Jeremy Lamb G Jordan Clarkson SG J.J. Barea PF Pascal Siakam PG Ish Smith",NA,"","","",NA
704,937266146,"twomindsbluff (8/10)",0,235,"G Russell Westbrook UTIL Kristaps Porzingis SG Tyreke Evans PG Elfrid Payton F Trevor Booker C Marcin Gortat SF JaMychal Green PF Bam Adebayo",NA,"","","",NA
704,937319026,"teddyballgame237",0,235,"G Russell Westbrook PF DeMarcus Cousins SF Tyreke Evans UTIL Steven Adams SG Jonathon Simmons F Pascal Siakam PG Ish Smith C Bam Adebayo",NA,"","","",NA
704,937541833,"jamesreidjr (2/2)",0,235,"C DeMarcus Cousins PF Anthony Davis SF Harrison Barnes SG Jeremy Lamb G Caris LeVert UTIL Kelly Olynyk PG Michael Carter-Williams F Bam Adebayo",NA,"","","",NA
704,937773806,"dpcollects",0,235,"G Russell Westbrook F DeMarcus Cousins SG Tyreke Evans C Steven Adams SF Jonathon Simmons UTIL Pascal Siakam PG Ish Smith PF Bam Adebayo",NA,"","","",NA
708,937203060,"brewers828",0,234.75,"C Marc Gasol UTIL Bradley Beal PG Chris Paul SF Harrison Barnes F DeMarre Carroll SG Nicolas Batum PF Kelly Olynyk G Andrew Harrison",NA,"","","",NA
708,937297063,"petteytheft89 (15/24)",0,234.75,"F DeMarcus Cousins G Chris Paul SF Tyreke Evans UTIL Harrison Barnes SG Nicolas Batum C Greg Monroe PG Jarrett Jack PF Bam Adebayo",NA,"","","",NA
708,937317598,"juanshen (15/15)",0,234.75,"C Joel Embiid SG Bradley Beal SF Otto Porter UTIL Harrison Barnes G Dennis Smith Jr. PF Trevor Booker F Wesley Matthews PG Michael Carter-Williams",NA,"","","",NA
708,937345726,"BigT44 (3/4)",0,234.75,"UTIL DeMarcus Cousins G Stephen Curry F Carmelo Anthony SG Tyreke Evans C Greg Monroe PG Michael Carter-Williams SF Marvin Williams PF Jordan Bell",NA,"","","",NA
708,937781570,"allabout3837 (24/41)",0,234.75,"G James Harden UTIL DeMarcus Cousins SG Nicolas Batum PF Dirk Nowitzki PG J.J. Barea SF JaMychal Green C Kelly Olynyk F Bam Adebayo",NA,"","","",NA
713,937735810,"jatart (2/5)",0,234.5,"PG James Harden C Andre Drummond SF Harrison Barnes G Dennis Smith Jr. F Wesley Matthews SG Caris LeVert PF JaMychal Green UTIL Pascal Siakam",NA,"","","",NA
714,936954108,"underjones (9/15)",0,234.25,"PG Russell Westbrook UTIL Spencer Dinwiddie PF Otto Porter SG Tyreke Evans C Steven Adams F Wesley Matthews SF JaMychal Green G Jarrett Jack",NA,"","","",NA
714,937753737,"MattyFatStackS",0,234.25,"C Marc Gasol G Kyle Lowry UTIL Dwight Howard F Otto Porter SF Tim Hardaway Jr. SG Kentavious Caldwell-Pope PG Michael Carter-Williams PF Bam Adebayo",NA,"","","",NA
716,937054032,"brianlefevre (12/25)",0,234,"SG James Harden C Andre Drummond SF Harrison Barnes G Dennis Smith Jr. PF Dirk Nowitzki UTIL Wesley Matthews F Joe Harris PG Ish Smith",NA,"","","",NA
716,937171333,"cheddabisque (26/41)",0,234,"UTIL Andre Drummond PF Draymond Green C Nikola Vucevic SF Tobias Harris F Pau Gasol G Wesley Matthews SG Caris LeVert PG Jarrett Jack",NA,"","","",NA
718,936960276,"pianoclub (29/41)",0,233.75,"C Andre Drummond G Bradley Beal SG Tyreke Evans SF Harrison Barnes F Enes Kanter UTIL Steven Adams PG Rajon Rondo PF Pascal Siakam",NA,"","","",NA
718,937082835,"justinallsup (2/2)",0,233.75,"SG Bradley Beal PG Chris Paul C Nikola Vucevic G Tyreke Evans PF Harrison Barnes F Courtney Lee UTIL Wesley Matthews SF Michael Kidd-Gilchrist",NA,"","","",NA
718,937120453,"TeeJayOrTj (1/3)",0,233.75,"PF DeMarcus Cousins C Karl-Anthony Towns SF Harrison Barnes UTIL Elfrid Payton SG Nicolas Batum F Caris LeVert PG Michael Carter-Williams G Sean Kilpatrick",NA,"","","",NA
718,937189263,"Kobe4MVP (15/41)",0,233.75,"UTIL Andre Drummond F Kristaps Porzingis PG Kyle Lowry C Nikola Vucevic SG Courtney Lee SF Caris LeVert G Tyler Johnson PF Pascal Siakam",NA,"","","",NA
718,937317597,"juanshen (14/15)",0,233.75,"C Joel Embiid UTIL Marc Gasol SG Tyreke Evans PF Harrison Barnes G Dennis Smith Jr. PG J.J. Barea SF Wesley Matthews F JaMychal Green",NA,"","","",NA
723,937128148,"Blomo3221",0,233.5,"PG Russell Westbrook C Karl-Anthony Towns SG Jimmy Butler G Elfrid Payton UTIL Marcin Gortat SF Jonathon Simmons PF Bam Adebayo F Andre Roberson",NA,"","","",NA
723,937309329,"mavngoose (2/2)",0,233.5,"PG Russell Westbrook UTIL Spencer Dinwiddie SF Harrison Barnes G Nicolas Batum SG Dennis Smith Jr. C Steven Adams F Bojan Bogdanovic PF Pascal Siakam",NA,"","","",NA
723,937737874,"CSURAM88",0,233.5,"UTIL Kevin Durant G Chris Paul SG Tyreke Evans SF Harrison Barnes PG Dennis Smith Jr. C Steven Adams PF Trevor Booker F Pascal Siakam",NA,"","","",NA
723,937755885,"petteytheft89 (23/24)",0,233.5,"UTIL DeMarcus Cousins G Spencer Dinwiddie F Harrison Barnes PG Elfrid Payton SG Nicolas Batum C Steven Adams SF J.J. Redick PF Bam Adebayo",NA,"","","",NA
727,937054405,"rikkidee (11/25)",0,233.25,"C Joel Embiid PG Chris Paul SG Jimmy Butler PF Otto Porter F Enes Kanter G Wesley Matthews SF Michael Kidd-Gilchrist UTIL Bam Adebayo",NA,"","","",NA
727,937202306,"BigSid (1/2)",0,233.25,"PF Anthony Davis SG Tim Hardaway Jr. SF Harrison Barnes PG Elfrid Payton C Enes Kanter F Jeremy Lamb UTIL J.J. Redick G Michael Carter-Williams",NA,"","","",NA
727,937511950,"jeffk1717",0,233.25,"SG Bradley Beal PF Draymond Green UTIL T.J. Warren SF Tobias Harris G Jrue Holiday F J.J. Redick C Julius Randle PG Michael Carter-Williams",NA,"","","",NA
727,937770648,"papagates (18/25)",0,233.25,"F DeMarcus Cousins UTIL Joel Embiid PF Enes Kanter PG Dennis Smith Jr. C Steven Adams SF JaMychal Green SG Joe Harris G Sean Kilpatrick",NA,"","","",NA
731,936703160,"ChipotleAddict (1/41)",0,233,"PF DeMarcus Cousins SF Kevin Durant UTIL Myles Turner F Harrison Barnes G Dennis Smith Jr. C Kelly Olynyk SG Stanley Johnson PG Sean Kilpatrick",NA,"","","",NA
731,937054044,"brianlefevre (17/25)",0,233,"SG James Harden F Kristaps Porzingis SF Harrison Barnes PG Reggie Jackson C Dirk Nowitzki UTIL Wesley Matthews G Caris LeVert PF Kelly Olynyk",NA,"","","",NA
731,937171343,"cheddabisque (36/41)",0,233,"C Karl-Anthony Towns PF Kristaps Porzingis G Kyle Lowry SF Harrison Barnes PG Elfrid Payton F Wesley Matthews SG Caris LeVert UTIL Jarrett Jack",NA,"","","",NA
731,937459489,"mariob888 (2/2)",0,233,"F Paul George PG Chris Paul UTIL Spencer Dinwiddie G Tim Hardaway Jr. PF Harrison Barnes SG Kentavious Caldwell-Pope SF JaMychal Green C Bam Adebayo",NA,"","","",NA
731,937781556,"allabout3837 (10/41)",0,233,"PG James Harden SG Bradley Beal UTIL Tyreke Evans F Jeremy Lamb SF Markieff Morris C Greg Monroe G Jonathon Simmons PF Kelly Olynyk",NA,"","","",NA
736,936956378,"moklovin (7/20)",0,232.75,"PG Russell Westbrook F DeMarcus Cousins UTIL Harrison Barnes C Steven Adams SF Wesley Matthews G Michael Carter-Williams PF Pascal Siakam SG Sean Kilpatrick",NA,"","","",NA
736,937043412,"EmileHeskey (28/41)",0,232.75,"F Kristaps Porzingis C Nikola Vucevic PF Aaron Gordon SF Tyreke Evans PG Reggie Jackson G Dennis Smith Jr. UTIL Steven Adams SG Stanley Johnson",NA,"","","",NA
736,937443384,"BrandonAdams (5/41)",0,232.75,"G James Harden PG Chris Paul C Myles Turner F Nicolas Batum SF Thaddeus Young SG Bojan Bogdanovic UTIL Michael Carter-Williams PF Marvin Williams",NA,"","","",NA
736,937474023,"bagavp",0,232.75,"F Paul George PG Kyle Lowry SF Otto Porter UTIL James Johnson G Nicolas Batum SG Jeremy Lamb C Dario Saric PF Alex Len",NA,"","","",NA
740,936840370,"Awesemo (1/41)",0,232.5,"C Joel Embiid PF Kristaps Porzingis F Draymond Green UTIL Dwight Howard PG Reggie Jackson SF Stanley Johnson G Michael Carter-Williams SG Sean Kilpatrick",NA,"","","",NA
740,936871341,"wnolen",0,232.5,"G Russell Westbrook SG Victor Oladipo PF Kristaps Porzingis C Trevor Booker F Greg Monroe SF Jonathon Simmons UTIL Pascal Siakam PG Ish Smith",NA,"","","",NA
740,937110042,"bcalicore",0,232.5,"UTIL Andre Drummond C Marc Gasol PG Kyle Lowry G Tyreke Evans PF Enes Kanter SG Jonathon Simmons SF Michael Kidd-Gilchrist F Pascal Siakam",NA,"","","",NA
740,937166017,"youdacao (4/41)",0,232.5,"G Stephen Curry UTIL Marc Gasol SG Jimmy Butler C Myles Turner SF Harrison Barnes F Trevor Booker PF Pascal Siakam PG Sean Kilpatrick",NA,"","","",NA
740,937189275,"Kobe4MVP (27/41)",0,232.5,"PG Chris Paul SG Jimmy Butler UTIL Nikola Vucevic F Pau Gasol SF Harrison Barnes G Evan Fournier C Trevor Booker PF JaMychal Green",NA,"","","",NA
740,937407030,"BarOfSoap",0,232.5,"UTIL Marc Gasol F LaMarcus Aldridge SF Harrison Barnes PG Reggie Jackson SG Nicolas Batum G Dennis Smith Jr. C Steven Adams PF Serge Ibaka",NA,"","","",NA
746,936954103,"underjones (4/15)",0,232.25,"C Karl-Anthony Towns PF Draymond Green SG Spencer Dinwiddie G Tyreke Evans UTIL DeMarre Carroll PG Dennis Smith Jr. SF Wesley Matthews F JaMychal Green",NA,"","","",NA
746,937189267,"Kobe4MVP (19/41)",0,232.25,"C Joel Embiid UTIL Karl-Anthony Towns PF Pau Gasol SF Harrison Barnes SG Evan Fournier F Trevor Booker G Wesley Matthews PG Jarrett Jack",NA,"","","",NA
746,937377662,"Ebone17",0,232.25,"PF Kristaps Porzingis G Kyle Lowry SG Jimmy Butler SF Dion Waiters UTIL Myles Turner PG Darren Collison F Courtney Lee C Zaza Pachulia",NA,"","","",NA
749,937266141,"twomindsbluff (3/10)",0,232,"C Joel Embiid UTIL Marc Gasol PF Kristaps Porzingis G Elfrid Payton SG Nicolas Batum SF Kelly Oubre Jr. PG Michael Carter-Williams F Bam Adebayo",NA,"","","",NA
749,937399113,"Jwaz",0,232,"PG James Harden SF Kevin Durant G Dennis Smith Jr. C Steven Adams UTIL Trevor Booker SG Courtney Lee F Jonathon Simmons PF Pascal Siakam",NA,"","","",NA
749,937451879,"DraftCheat (2/2)",0,232,"PF DeMarcus Cousins PG Stephen Curry SF Harrison Barnes C Steven Adams UTIL Dirk Nowitzki SG Wesley Matthews G Caris LeVert F Bam Adebayo",NA,"","","",NA
749,937687124,"tombradyisgray (1/4)",0,232,"UTIL Russell Westbrook SG Bradley Beal G Tim Hardaway Jr. F Harrison Barnes SF Nicolas Batum PG J.J. Barea PF Pascal Siakam C Bam Adebayo",NA,"","","",NA
753,937054417,"rikkidee (23/25)",0,231.75,"SG Jimmy Butler UTIL Nikola Vucevic PG Spencer Dinwiddie SF Tobias Harris C Myles Turner PF James Johnson F Greg Monroe G Wesley Matthews",NA,"","","",NA
753,937318265,"dmiller61 (3/3)",0,231.75,"G Russell Westbrook C Marc Gasol SF Harrison Barnes UTIL Steven Adams F Trevor Booker PF Dirk Nowitzki SG Wesley Matthews PG T.J. McConnell",NA,"","","",NA
753,937755903,"donkosaurus (6/7)",0,231.75,"PG Russell Westbrook F Kristaps Porzingis G Tyreke Evans SF Harrison Barnes SG Nicolas Batum UTIL Greg Monroe PF Pascal Siakam C Bam Adebayo",NA,"","","",NA
756,937105054,"bw5126 (7/41)",0,231.5,"F Kevin Durant PF Kristaps Porzingis UTIL Draymond Green C Dwight Howard SF Harrison Barnes PG Jarrett Jack G Michael Carter-Williams SG Sean Kilpatrick",NA,"","","",NA
756,937166031,"youdacao (18/41)",0,231.5,"PG Russell Westbrook C Kristaps Porzingis SG Jimmy Butler F Tyreke Evans PF Trevor Booker G Jarrett Jack UTIL Michael Carter-Williams SF Andre Roberson",NA,"","","",NA
756,937317591,"juanshen (8/15)",0,231.5,"C Joel Embiid UTIL Stephen Curry PG Spencer Dinwiddie F Harrison Barnes G Dennis Smith Jr. SF Wesley Matthews PF Pascal Siakam SG Sean Kilpatrick",NA,"","","",NA
756,937530436,"cjbeast1",0,231.5,"UTIL Andre Drummond PF Kristaps Porzingis PG Chris Paul SF Harrison Barnes C Enes Kanter SG J.J. Barea F Kelly Olynyk G Ish Smith",NA,"","","",NA
760,936774179,"0_for_5",0,231,"PG Russell Westbrook PF DeMarcus Cousins SF Harrison Barnes SG Dennis Smith Jr. UTIL Jonathon Simmons G Michael Carter-Williams F Pascal Siakam C Bam Adebayo",NA,"","","",NA
760,937043423,"EmileHeskey (39/41)",0,231,"SG Bradley Beal PG Kyle Lowry C Nikola Vucevic SF Tyreke Evans G Dennis Smith Jr. UTIL Steven Adams PF Dirk Nowitzki F Joe Harris",NA,"","","",NA
760,937561169,"FumbleMachine",0,231,"F Kristaps Porzingis G Kyle Lowry PF Otto Porter UTIL Tobias Harris PG Elfrid Payton C Enes Kanter SG Eric Gordon SF Norman Powell",NA,"","","",NA
760,937781555,"allabout3837 (9/41)",0,231,"PG James Harden SG Bradley Beal UTIL Tyreke Evans F Nicolas Batum G Eric Gordon C Greg Monroe SF JaMychal Green PF Pascal Siakam",NA,"","","",NA
764,936953950,"scout326 (3/20)",0,230.75,"C Andre Drummond UTIL Kristaps Porzingis F Draymond Green SF Harrison Barnes G Reggie Jackson PG Elfrid Payton PF Pascal Siakam SG Sean Kilpatrick",NA,"","","",NA
764,937065704,"getoffme2312 (4/14)",0,230.75,"PF Anthony Davis SG Jimmy Butler SF Aaron Gordon F Nicolas Batum C Steven Adams UTIL Kyle Anderson G Dillon Brooks PG Michael Carter-Williams",NA,"","","",NA
764,937610794,"underjones (15/15)",0,230.75,"UTIL Kevin Durant C Karl-Anthony Towns PG Kyle Lowry F DeMarre Carroll G Rajon Rondo PF Dirk Nowitzki SG Wesley Matthews SF Michael Kidd-Gilchrist",NA,"","","",NA
