"Rank","EntryId","EntryName","TimeRemaining","Points","Lineup","X","Player","Roster.Position","X.Drafted","FPTS"
2065,936998939,"ODAAT (1/2)",0,224.25,"C Andre Drummond UTIL Marc Gasol PG Jrue Holiday F Tim Hardaway Jr. SF Kyle Anderson PF Dirk Nowitzki G Courtney Lee SG J.J. Barea",NA,"","","",NA
2065,937048965,"amula6968",0,224.25,"PG James Harden UTIL Andre Drummond C Nikola Vucevic SF Tobias Harris SG Jordan Clarkson G Wayne Ellington F Michael Beasley PF Marreese Speights",NA,"","","",NA
2065,937112491,"Nateorious (5/20)",0,224.25,"F Kristaps Porzingis SF Devin Booker PF Tobias Harris C Myles Turner UTIL Harrison Barnes G Jeremy Lamb SG Courtney Lee PG Michael Carter-Williams",NA,"","","",NA
2065,937193529,"daksrus",0,224.25,"PG Chris Paul SF Devin Booker SG Tim Hardaway Jr. C Myles Turner PF Harrison Barnes UTIL J.J. Redick F Trevor Ariza G Courtney Lee",NA,"","","",NA
2065,937281435,"bigsed56 (4/4)",0,224.25,"UTIL Nikola Vucevic SF Otto Porter SG Jrue Holiday G Tim Hardaway Jr. C Pau Gasol PG Reggie Jackson PF Thaddeus Young F Kyle Anderson",NA,"","","",NA
2065,937299491,"rggrant (5/11)",0,224.25,"PG Russell Westbrook C Anthony Davis F Harrison Barnes SG Wesley Matthews SF Caris LeVert G Jonathon Simmons UTIL JaMychal Green PF Pascal Siakam",NA,"","","",NA
2065,937388005,"vittomental (2/2)",0,224.25,"PG James Harden C Andre Drummond SG Chris Paul F Tim Hardaway Jr. SF Stanley Johnson PF Pascal Siakam UTIL Ish Smith G Tomas Satoransky",NA,"","","",NA
2065,937398259,"djacksosfg (4/6)",0,224.25,"PF DeMarcus Cousins C Dwight Howard UTIL T.J. Warren SG Avery Bradley PG Reggie Jackson SF Wesley Matthews F Lance Stephenson G Ish Smith",NA,"","","",NA
2079,936971396,"sspiva1",0,224,"UTIL Anthony Davis SG Devin Booker SF Tobias Harris G Brandon Ingram PF Enes Kanter PG Dennis Smith Jr. F Pascal Siakam C Bam Adebayo",NA,"","","",NA
2079,936997911,"reefchief (1/6)",0,224,"UTIL Andre Drummond F Paul George PG Chris Paul G Jeremy Lamb C Trevor Booker PF Dirk Nowitzki SF Danny Green SG Joe Harris",NA,"","","",NA
2079,937222585,"trypeoples",0,224,"PG Chris Paul SG Klay Thompson PF Draymond Green G Lonzo Ball SF Brandon Ingram UTIL J.J. Redick C Brook Lopez F Omri Casspi",NA,"","","",NA
2079,937385574,"joeyw42 (4/8)",0,224,"SG James Harden F T.J. Warren PF Harrison Barnes UTIL Kyle Kuzma G Kentavious Caldwell-Pope SF Kyle Anderson PG Tyus Jones C Bam Adebayo",NA,"","","",NA
2079,937419564,"Smashmouthreturns (4/4)",0,224,"G James Harden C Joel Embiid UTIL Chris Paul PG Rajon Rondo SF Wesley Matthews PF Marquese Chriss SG E'Twaun Moore F Luc Richard Mbah a Moute",NA,"","","",NA
2079,937457545,"mainevent_1 (2/3)",0,224,"G James Harden SG Stephen Curry C Kristaps Porzingis SF Jonathon Simmons PG Tyus Jones F JaMychal Green PF Frank Kaminsky UTIL Darius Miller",NA,"","","",NA
2085,936831178,"nicvello23 (3/4)",0,223.75,"PF Kristaps Porzingis PG Kyle Lowry C Dwight Howard SF Tim Hardaway Jr. G Dion Waiters UTIL James Johnson F Courtney Lee SG Tomas Satoransky",NA,"","","",NA
2085,936911356,"giannis.bledsoe",0,223.75,"PG Lonzo Ball F Tim Hardaway Jr. C Myles Turner UTIL Robert Covington PF Harrison Barnes G Brandon Ingram SF Kyle Kuzma SG Dennis Smith Jr.",NA,"","","",NA
2085,936917903,"inner-peace",0,223.75,"C Kristaps Porzingis G Bradley Beal UTIL Andrew Wiggins SG Tim Hardaway Jr. PF Harrison Barnes F Jeremy Lamb PG Tyus Jones SF Norman Powell",NA,"","","",NA
2085,936926576,"csmaniac (1/20)",0,223.75,"F DeMarcus Cousins PG Chris Paul SF Tobias Harris UTIL Myles Turner C Steven Adams SG J.J. Barea G Patty Mills PF Pascal Siakam",NA,"","","",NA
2085,937113071,"kobe4mvp24 (2/2)",0,223.75,"PG Russell Westbrook C Clint Capela PF James Johnson SG Nicolas Batum G Dennis Smith Jr. F Larry Nance Jr. SF Wesley Matthews UTIL Bam Adebayo",NA,"","","",NA
2085,937173843,"BeanoTheKid (2/12)",0,223.75,"C Andre Drummond G Chris Paul UTIL Dwight Howard PG Reggie Jackson SG Nicolas Batum F Jeremy Lamb SF Wesley Matthews PF Pascal Siakam",NA,"","","",NA
2085,937173853,"BeanoTheKid (5/12)",0,223.75,"C Andre Drummond G Chris Paul UTIL Dwight Howard PG Reggie Jackson SG Nicolas Batum F Jeremy Lamb SF Wesley Matthews PF Pascal Siakam",NA,"","","",NA
2085,937173862,"BeanoTheKid (8/12)",0,223.75,"C Andre Drummond G Chris Paul UTIL Dwight Howard PG Reggie Jackson SG Nicolas Batum F Jeremy Lamb SF Wesley Matthews PF Pascal Siakam",NA,"","","",NA
2085,937181167,"BeanoTheKid (11/12)",0,223.75,"C Andre Drummond G Chris Paul UTIL Dwight Howard PG Reggie Jackson SG Nicolas Batum F Jeremy Lamb SF Wesley Matthews PF Pascal Siakam",NA,"","","",NA
2085,937208321,"Firecaptainof3",0,223.75,"C Joel Embiid SF Paul George PG John Wall SG Bradley Beal F Kelly Oubre Jr. UTIL Michael Kidd-Gilchrist PF Gorgui Dieng G Treveon Graham",NA,"","","",NA
2085,937294197,"zeus89 (3/20)",0,223.75,"C Andre Drummond UTIL Bradley Beal SG Jimmy Butler PF Harrison Barnes F Nicolas Batum G Wesley Matthews SF Caris LeVert PG Michael Carter-Williams",NA,"","","",NA
2085,937297838,"HamHandsBill (1/4)",0,223.75,"C DeMarcus Cousins SG Bradley Beal F Tobias Harris PG Dennis Smith Jr. G Rajon Rondo PF Dirk Nowitzki UTIL Jordan Clarkson SF Lance Stephenson",NA,"","","",NA
2097,937336008,"Gator2291",0,223.5,"SG James Harden F Otto Porter SF Harrison Barnes G Kentavious Caldwell-Pope PG Dennis Smith Jr. C Steven Adams UTIL Dirk Nowitzki PF Pascal Siakam",NA,"","","",NA
2097,937443328,"rseid12345 (12/20)",0,223.5,"PG Russell Westbrook F DeMarcus Cousins SG Dennis Smith Jr. UTIL Rajon Rondo C Dirk Nowitzki SF Wesley Matthews G Tyler Johnson PF Bam Adebayo",NA,"","","",NA
2099,936798455,"turn2gold",0,223.25,"C Andre Drummond SF Devin Booker SG Jimmy Butler PF Pau Gasol F Kyle Anderson UTIL Courtney Lee PG J.J. Barea G Caris LeVert",NA,"","","",NA
2099,936941482,"BigHoj (19/20)",0,223.25,"PG Russell Westbrook G Stephen Curry UTIL Clint Capela C Marcin Gortat F Dirk Nowitzki SF Jonathon Simmons PF Pascal Siakam SG Isaiah Whitehead",NA,"","","",NA
2099,937314810,"reeltoreel",0,223.25,"SF Ben Simmons C Marc Gasol SG Tyreke Evans PF Tobias Harris G Tim Hardaway Jr. PG Kyle Anderson F Bam Adebayo UTIL Cory Joseph",NA,"","","",NA
2099,937402804,"Bossant",0,223.25,"F Anthony Davis C Clint Capela SF Tyreke Evans PF Tobias Harris G Kentavious Caldwell-Pope PG T.J. McConnell SG Tyus Jones UTIL Pascal Siakam",NA,"","","",NA
2103,936845450,"GreyPoupon (3/20)",0,223,"C Andre Drummond UTIL Bradley Beal PF Harrison Barnes PG Reggie Jackson SF Nicolas Batum G Dennis Smith Jr. F Wesley Matthews SG Caris LeVert",NA,"","","",NA
2103,936882466,"isagunner (3/5)",0,223,"UTIL Russell Westbrook F DeMarcus Cousins SF Tyreke Evans C Dirk Nowitzki PG J.J. Barea G T.J. McConnell SG Sean Kilpatrick PF Bam Adebayo",NA,"","","",NA
2103,937444860,"seban917 (1/2)",0,223,"C Kristaps Porzingis PG Kyle Lowry SF Tobias Harris PF Robert Covington F Harrison Barnes SG Dennis Smith Jr. G Rajon Rondo UTIL Greg Monroe",NA,"","","",NA
2103,937450663,"greenbayjinxx (4/4)",0,223,"UTIL Joel Embiid SG Bradley Beal PF Otto Porter F Robert Covington SF J.J. Redick C Dario Saric G T.J. McConnell PG Michael Carter-Williams",NA,"","","",NA
2107,937206305,"Lastblows (10/20)",0,222.75,"PG Russell Westbrook PF Kristaps Porzingis SG Chris Paul C Steven Adams G Rajon Rondo UTIL Tyler Johnson SF Kelly Oubre Jr. F Bam Adebayo",NA,"","","",NA
2107,937236589,"DGoober1 (1/4)",0,222.75,"PG James Harden PF Anthony Davis C Taj Gibson SF Wesley Matthews SG Tyus Jones UTIL Alex Len F Lance Stephenson G Malik Monk",NA,"","","",NA
2107,937299492,"rggrant (6/11)",0,222.75,"PF Anthony Davis C Joel Embiid F Harrison Barnes SG Nicolas Batum SF Wesley Matthews G Caris LeVert PG Michael Carter-Williams UTIL Pascal Siakam",NA,"","","",NA
2107,937483442,"teamramrod7295 (1/5)",0,222.75,"SF Kevin Durant C Andre Drummond PG Reggie Jackson F Enes Kanter PF Domantas Sabonis UTIL Marcin Gortat SG Wesley Matthews G Joe Harris",NA,"","","",NA
2111,936657865,"elray21",0,222.5,"G James Harden C Andre Drummond PF Enes Kanter UTIL Brook Lopez SG Eric Gordon F Bojan Bogdanovic SF Danny Green PG Tony Parker",NA,"","","",NA
2111,936875492,"mgm11 (1/4)",0,222.5,"PF DeMarcus Cousins SG Jimmy Butler SF Tyreke Evans C Enes Kanter UTIL Dennis Smith Jr. F Trevor Booker G Jonathon Simmons PG Jarrett Jack",NA,"","","",NA
2111,936875513,"granny61990",0,222.5,"SG Klay Thompson UTIL Clint Capela SF Tim Hardaway Jr. G Dion Waiters PF Robert Covington PG Reggie Jackson C Steven Adams F Serge Ibaka",NA,"","","",NA
2111,936883761,"mgm11 (2/4)",0,222.5,"PF DeMarcus Cousins SG Jimmy Butler SF Tyreke Evans C Enes Kanter UTIL Dennis Smith Jr. F Trevor Booker G Jonathon Simmons PG Jarrett Jack",NA,"","","",NA
2111,936883845,"mgm11 (3/4)",0,222.5,"PF DeMarcus Cousins SG Jimmy Butler SF Tyreke Evans C Enes Kanter UTIL Dennis Smith Jr. F Trevor Booker G Jonathon Simmons PG Jarrett Jack",NA,"","","",NA
2111,936883858,"mgm11 (4/4)",0,222.5,"PF DeMarcus Cousins SG Jimmy Butler SF Tyreke Evans C Enes Kanter UTIL Dennis Smith Jr. F Trevor Booker G Jonathon Simmons PG Jarrett Jack",NA,"","","",NA
2111,936979644,"seminole70",0,222.5,"PF LaMarcus Aldridge C Hassan Whiteside PG Kyle Lowry SG Klay Thompson SF Tim Hardaway Jr. UTIL Kelly Oubre Jr. G Stanley Johnson F Andre Iguodala",NA,"","","",NA
2111,936986132,"jamie2111 (3/6)",0,222.5,"PF Anthony Davis UTIL Andre Drummond F Tyreke Evans SF Harrison Barnes G Elfrid Payton PG Michael Carter-Williams C Bam Adebayo SG Isaiah Whitehead",NA,"","","",NA
2111,936989519,"jamie2111 (5/6)",0,222.5,"PF Anthony Davis UTIL Andre Drummond F Tyreke Evans SF Harrison Barnes G Elfrid Payton PG Michael Carter-Williams C Bam Adebayo SG Isaiah Whitehead",NA,"","","",NA
2111,936989521,"jamie2111 (6/6)",0,222.5,"PF Anthony Davis UTIL Andre Drummond F Tyreke Evans SF Harrison Barnes G Elfrid Payton PG Michael Carter-Williams C Bam Adebayo SG Isaiah Whitehead",NA,"","","",NA
2111,937006733,"gatorrick (1/20)",0,222.5,"G Chris Paul UTIL Kyle Lowry C Clint Capela SG Jimmy Butler PG Dennis Smith Jr. PF Larry Nance Jr. SF Jonathon Simmons F Pascal Siakam",NA,"","","",NA
2111,937225140,"StreetDiesel40",0,222.5,"UTIL Russell Westbrook PF Kristaps Porzingis C Draymond Green F T.J. Warren SG Lance Stephenson SF Norman Powell G Michael Carter-Williams PG Tomas Satoransky",NA,"","","",NA
2123,937037804,"loopy22",0,222.25,"PF Anthony Davis UTIL Karl-Anthony Towns SF Andrew Wiggins SG Dion Waiters G T.J. McConnell PG Tyus Jones C Kelly Olynyk F Marquese Chriss",NA,"","","",NA
2123,937297534,"DFSKing (1/5)",0,222.25,"F Kristaps Porzingis UTIL Dwight Howard G Tyreke Evans PF Tobias Harris SF Harrison Barnes SG Kentavious Caldwell-Pope C Steven Adams PG Michael Carter-Williams",NA,"","","",NA
2123,937303470,"DFSKing (2/5)",0,222.25,"F Kristaps Porzingis UTIL Dwight Howard G Tyreke Evans PF Tobias Harris SF Harrison Barnes SG Kentavious Caldwell-Pope C Steven Adams PG Michael Carter-Williams",NA,"","","",NA
2123,937303488,"DFSKing (3/5)",0,222.25,"F Kristaps Porzingis UTIL Dwight Howard G Tyreke Evans PF Tobias Harris SF Harrison Barnes SG Kentavious Caldwell-Pope C Steven Adams PG Michael Carter-Williams",NA,"","","",NA
2123,937336929,"SnowBallZ (5/6)",0,222.25,"PG Stephen Curry F Kevin Durant C Andre Drummond SF Wesley Matthews SG Caris LeVert G Jonathon Simmons UTIL Josh Richardson PF Pascal Siakam",NA,"","","",NA
2128,936829991,"Krooklyndodger (2/4)",0,222,"PG Russell Westbrook SG Chris Paul SF Dion Waiters PF Harrison Barnes C Domantas Sabonis F Greg Monroe G T.J. McConnell UTIL Joakim Noah",NA,"","","",NA
2128,936839976,"BoomBap95 (7/8)",0,222,"C DeMarcus Cousins SG Jimmy Butler PF Harrison Barnes UTIL Taj Gibson G Nicolas Batum PG Dennis Smith Jr. SF Lance Stephenson F Bam Adebayo",NA,"","","",NA
2128,937169681,"NJ82 (2/2)",0,222,"PG Russell Westbrook SG Klay Thompson PF Tobias Harris F Kyle Kuzma SF Jeremy Lamb G Courtney Lee C Alex Len UTIL Norman Powell",NA,"","","",NA
2128,937174532,"chaamason30",0,222,"UTIL Draymond Green PF Andrew Wiggins PG Lonzo Ball SF Tim Hardaway Jr. G Dion Waiters SG Dennis Smith Jr. F J.J. Redick C Marcin Gortat",NA,"","","",NA
2128,937246715,"Coachcampbell91 (1/5)",0,222,"F DeMarcus Cousins C Anthony Davis SF Harrison Barnes PF Trevor Booker SG J.J. Barea UTIL Wesley Matthews PG Michael Carter-Williams G Ish Smith",NA,"","","",NA
2128,937246738,"Coachcampbell91 (2/5)",0,222,"F DeMarcus Cousins C Anthony Davis SF Harrison Barnes PF Trevor Booker SG J.J. Barea UTIL Wesley Matthews PG Michael Carter-Williams G Ish Smith",NA,"","","",NA
2128,937246766,"Coachcampbell91 (3/5)",0,222,"F DeMarcus Cousins C Anthony Davis SF Harrison Barnes PF Trevor Booker SG J.J. Barea UTIL Wesley Matthews PG Michael Carter-Williams G Ish Smith",NA,"","","",NA
2128,937246791,"Coachcampbell91 (4/5)",0,222,"F DeMarcus Cousins C Anthony Davis SF Harrison Barnes PF Trevor Booker SG J.J. Barea UTIL Wesley Matthews PG Michael Carter-Williams G Ish Smith",NA,"","","",NA
2128,937246821,"Coachcampbell91 (5/5)",0,222,"F DeMarcus Cousins C Anthony Davis SF Harrison Barnes PF Trevor Booker SG J.J. Barea UTIL Wesley Matthews PG Michael Carter-Williams G Ish Smith",NA,"","","",NA
2128,937486004,"9erfan4life (14/20)",0,222,"UTIL Tyreke Evans F Tobias Harris PG Jrue Holiday G Tim Hardaway Jr. PF Pau Gasol SF Harrison Barnes SG Avery Bradley C Domantas Sabonis",NA,"","","",NA
2138,936832894,"heatville",0,221.75,"UTIL Andre Drummond C Marc Gasol SF Tobias Harris F Harrison Barnes SG Jeremy Lamb G Kyle Anderson PG J.J. Barea PF Alex Len",NA,"","","",NA
2138,936928733,"Joeoconnor7",0,221.75,"UTIL Andre Drummond SG Chris Paul C Clint Capela SF Harrison Barnes F Jeremy Lamb PF Domantas Sabonis PG J.J. Barea G Cory Joseph",NA,"","","",NA
2138,937141094,"djacksosfg (1/6)",0,221.75,"PF Anthony Davis UTIL Klay Thompson C Dwight Howard SG Avery Bradley PG Reggie Jackson SF Wesley Matthews F Lance Stephenson G Ish Smith",NA,"","","",NA
2138,937166918,"tide345 (1/3)",0,221.75,"PG James Harden SF Otto Porter PF Tobias Harris SG Tim Hardaway Jr. F Harrison Barnes C Tyson Chandler UTIL Jerami Grant G Josh Jackson",NA,"","","",NA
2138,937169240,"tide345 (2/3)",0,221.75,"PG James Harden SF Otto Porter PF Tobias Harris SG Tim Hardaway Jr. F Harrison Barnes C Tyson Chandler UTIL Jerami Grant G Josh Jackson",NA,"","","",NA
2138,937169270,"tide345 (3/3)",0,221.75,"PG James Harden SF Otto Porter PF Tobias Harris SG Tim Hardaway Jr. F Harrison Barnes C Tyson Chandler UTIL Jerami Grant G Josh Jackson",NA,"","","",NA
2138,937195420,"DobermanDad (10/10)",0,221.75,"C Andre Drummond PG Chris Paul UTIL Dwight Howard PF Harrison Barnes SF Nicolas Batum F Wesley Matthews G Caris LeVert SG Jonathon Simmons",NA,"","","",NA
2138,937346164,"sherena48",0,221.75,"G James Harden SF Paul George PF Draymond Green PG Avery Bradley SG Eric Gordon UTIL Danny Green F Pascal Siakam C Marreese Speights",NA,"","","",NA
2138,937444676,"jue316",0,221.75,"PG Russell Westbrook F Kristaps Porzingis G Reggie Jackson C Steven Adams UTIL Larry Nance Jr. PF Trevor Booker SF Wesley Matthews SG Lance Stephenson",NA,"","","",NA
2147,936899493,"SpeakoftheDevs (3/5)",0,221.5,"PG Russell Westbrook C Andre Drummond PF Kristaps Porzingis SG Chris Paul F Pascal Siakam SF Doug McDermott UTIL Zaza Pachulia G Tomas Satoransky",NA,"","","",NA
2147,936914569,"BlueJays21 (1/2)",0,221.5,"PG Russell Westbrook SF Paul George PF Kristaps Porzingis UTIL Trevor Booker C Jonas Valanciunas SG Danny Green G Tyler Ulis F Bam Adebayo",NA,"","","",NA
2147,936921546,"BlueJays21 (2/2)",0,221.5,"PG Russell Westbrook SF Paul George PF Kristaps Porzingis UTIL Trevor Booker C Jonas Valanciunas SG Danny Green G Tyler Ulis F Bam Adebayo",NA,"","","",NA
2147,936934968,"Theophelps",0,221.5,"PG James Harden PF Kristaps Porzingis F Harrison Barnes SG J.J. Redick G Jordan Clarkson SF Bojan Bogdanovic C Serge Ibaka UTIL J.J. Barea",NA,"","","",NA
2147,937041987,"ZEUSMAN1711 (2/2)",0,221.5,"C Andre Drummond PF Kristaps Porzingis G Goran Dragic SF Andrew Wiggins SG Jeremy Lamb F Courtney Lee UTIL Josh Jackson PG Malik Monk",NA,"","","",NA
2147,937059252,"JBrown0825",0,221.5,"C Kristaps Porzingis F LaMarcus Aldridge SG Bradley Beal SF Tobias Harris G Jeremy Lamb PF Domantas Sabonis PG Tyus Jones UTIL Bam Adebayo",NA,"","","",NA
2147,937144349,"DSK3DSK3 (6/18)",0,221.5,"G James Harden C Andre Drummond PF Harrison Barnes UTIL Dennis Smith Jr. PG Rajon Rondo SF Courtney Lee SG J.J. Barea F Marreese Speights",NA,"","","",NA
2147,937315258,"jones_1184 (2/2)",0,221.5,"PG James Harden SF Paul George SG Spencer Dinwiddie F Domantas Sabonis PF Dirk Nowitzki G J.J. Barea UTIL T.J. McConnell C Tyler Zeller",NA,"","","",NA
2147,937359111,"Thrill7321 (1/4)",0,221.5,"PG Stephen Curry C Andre Drummond PF Harrison Barnes SF Nicolas Batum UTIL Steven Adams SG Wesley Matthews G Caris LeVert F Danny Green",NA,"","","",NA
2156,936906187,"Sdotbrown24 (4/20)",0,221.25,"C Joel Embiid PF Kristaps Porzingis SG Jimmy Butler SF Otto Porter UTIL Brandon Ingram G Jarrett Jack PG Michael Carter-Williams F Bam Adebayo",NA,"","","",NA
2156,936926603,"Jerrylee3332 (2/5)",0,221.25,"PG Ben Simmons C Hassan Whiteside SF Andrew Wiggins PF James Johnson SG J.J. Redick F Trevor Booker G Bojan Bogdanovic UTIL JaMychal Green",NA,"","","",NA
2156,937004994,"awedave",0,221.25,"C Andre Drummond UTIL Otto Porter SF Tobias Harris F Tim Hardaway Jr. PF Robert Covington G J.J. Redick SG Courtney Lee PG Tyus Jones",NA,"","","",NA
2156,937118565,"MrSuperBowl",0,221.25,"PF Kristaps Porzingis PG Chris Paul SF Harrison Barnes G Reggie Jackson F DeMarre Carroll SG Jeremy Lamb C Trevor Booker UTIL Danny Green",NA,"","","",NA
2156,937131000,"jjgrillo1313",0,221.25,"PG Russell Westbrook C Andre Drummond SG Klay Thompson SF Jeremy Lamb F Wesley Matthews G Caris LeVert PF Omri Casspi UTIL Luc Richard Mbah a Moute",NA,"","","",NA
2156,937398627,"jbrabend182 (4/4)",0,221.25,"PF Anthony Davis F Devin Booker C Draymond Green G Kentavious Caldwell-Pope PG Dennis Smith Jr. SF Courtney Lee SG Lance Stephenson UTIL Marvin Williams",NA,"","","",NA
2156,937470068,"9erfan4life (2/20)",0,221.25,"G Lonzo Ball UTIL Otto Porter SF Tyreke Evans F Tim Hardaway Jr. PF Pau Gasol SG Avery Bradley C Enes Kanter PG Kyle Anderson",NA,"","","",NA
2163,936832937,"nolefan31 (14/20)",0,221,"UTIL Karl-Anthony Towns G Chris Paul C Nikola Vucevic PG Elfrid Payton SF DeMarre Carroll SG Dennis Smith Jr. F Dirk Nowitzki PF Pascal Siakam",NA,"","","",NA
2163,937010544,"gatorrick (18/20)",0,221,"PG Goran Dragic SG Klay Thompson PF Tobias Harris UTIL Myles Turner SF Robert Covington G Reggie Jackson F J.J. Redick C Greg Monroe",NA,"","","",NA
2163,937010578,"gatorrick (19/20)",0,221,"PG Goran Dragic SG Klay Thompson PF Tobias Harris UTIL Myles Turner SF Robert Covington G Reggie Jackson F J.J. Redick C Greg Monroe",NA,"","","",NA
2163,937010585,"gatorrick (20/20)",0,221,"PG Goran Dragic SG Klay Thompson PF Tobias Harris UTIL Myles Turner SF Robert Covington G Reggie Jackson F J.J. Redick C Greg Monroe",NA,"","","",NA
2163,937051560,"dcampbell3208 (9/20)",0,221,"UTIL James Harden C Andre Drummond SG Devin Booker SF Bojan Bogdanovic G J.J. Barea F Joe Harris PG Michael Carter-Williams PF Bam Adebayo",NA,"","","",NA
2163,937294079,"zeus89 (1/20)",0,221,"F DeMarcus Cousins G Bradley Beal PF Harrison Barnes SG Nicolas Batum C Steven Adams UTIL Wesley Matthews SF Caris LeVert PG Michael Carter-Williams",NA,"","","",NA
2163,937311787,"tpschulz",0,221,"PF Kristaps Porzingis UTIL Bradley Beal PG Kyle Lowry F Devin Booker G Kentavious Caldwell-Pope C Alex Len SF Kelly Oubre Jr. SG Malik Monk",NA,"","","",NA
2163,937476814,"Psychoshiz (3/3)",0,221,"PG Russell Westbrook PF DeMarcus Cousins SG Klay Thompson C Julius Randle F Dirk Nowitzki SF Patrick McCaw UTIL Michael Beasley G Nick Young",NA,"","","",NA
2163,937498245,"derek.nep (1/2)",0,221,"SG James Harden PG Russell Westbrook PF Kristaps Porzingis C Steven Adams UTIL Kelly Oubre Jr. F Marreese Speights G Ramon Sessions SF Kevon Looney",NA,"","","",NA
2163,937499238,"derek.nep (2/2)",0,221,"SG James Harden PG Russell Westbrook PF Kristaps Porzingis C Steven Adams UTIL Kelly Oubre Jr. F Marreese Speights G Ramon Sessions SF Kevon Looney",NA,"","","",NA
2173,936908602,"steelpoor",0,220.75,"UTIL Anthony Davis F Tim Hardaway Jr. SF Harrison Barnes G Avery Bradley PG Elfrid Payton SG Nicolas Batum PF Thaddeus Young C Zaza Pachulia",NA,"","","",NA
2173,936977567,"schmalls09",0,220.75,"PG Russell Westbrook PF Kristaps Porzingis SF Otto Porter F Harrison Barnes C Dario Saric UTIL Jonathon Simmons SG Lance Stephenson G Norman Powell",NA,"","","",NA
2173,937105308,"ironman1400",0,220.75,"C DeMarcus Cousins UTIL Joel Embiid PF Kristaps Porzingis SG Jeremy Lamb PG T.J. McConnell F Kelly Oubre Jr. G Jerryd Bayless SF Doug McDermott",NA,"","","",NA
2173,937225809,"Jovan914 (7/20)",0,220.75,"C Karl-Anthony Towns SG Jimmy Butler PF Andrew Wiggins F Harrison Barnes G Nicolas Batum PG Dennis Smith Jr. UTIL Markieff Morris SF Caris LeVert",NA,"","","",NA
2173,937465682,"clk_47",0,220.75,"PG Russell Westbrook PF Kristaps Porzingis UTIL Myles Turner G Jeremy Lamb C Dirk Nowitzki F Serge Ibaka SG J.J. Barea SF Wesley Matthews",NA,"","","",NA
2178,936895656,"abragmania (2/20)",0,220.5,"UTIL James Harden G Victor Oladipo PG Chris Paul C Steven Adams SG Jonathon Simmons PF Kelly Olynyk F Michael Kidd-Gilchrist SF Marvin Williams",NA,"","","",NA
2178,937121116,"Nateorious (20/20)",0,220.5,"PG James Harden SF T.J. Warren PF Tobias Harris UTIL Harrison Barnes G Jeremy Lamb SG Courtney Lee C Alex Len F Patrick McCaw",NA,"","","",NA
2180,936834661,"ItsTechTron (3/8)",0,220.25,"G James Harden SF Paul George C Myles Turner UTIL Dennis Smith Jr. PG Rajon Rondo F Dirk Nowitzki SG Wesley Matthews PF Bam Adebayo",NA,"","","",NA
2180,936966488,"romansmom92 (3/5)",0,220.25,"PF DeMarcus Cousins C Karl-Anthony Towns SG Tyreke Evans F Harrison Barnes PG Rajon Rondo SF JaMychal Green UTIL Jarrett Jack G Michael Carter-Williams",NA,"","","",NA
2180,937116177,"Buff-Bagwell (1/2)",0,220.25,"PG Russell Westbrook SG Devin Booker SF Dion Waiters PF Domantas Sabonis G J.J. Redick C Marcin Gortat F Wesley Matthews UTIL Kelly Oubre Jr.",NA,"","","",NA
2180,937128205,"young_jvan",0,220.25,"C Joel Embiid SG Klay Thompson SF Tobias Harris PF Pau Gasol UTIL J.J. Redick G Eric Gordon F Markieff Morris PG Jordan Clarkson",NA,"","","",NA
2180,937410153,"buff_white_dude (2/2)",0,220.25,"C Andre Drummond SF Paul George PG Chris Paul SG Devin Booker PF Julius Randle UTIL Josh Jackson G Shaun Livingston F Ben McLemore",NA,"","","",NA
2180,937477730,"9erfan4life (6/20)",0,220.25,"SG Jimmy Butler G Jrue Holiday SF Tim Hardaway Jr. PF Pau Gasol C Myles Turner UTIL Robert Covington F Harrison Barnes PG T.J. McConnell",NA,"","","",NA
2186,937248572,"guydc",0,220,"PG James Harden SG Bradley Beal PF Otto Porter SF Trevor Ariza UTIL Eric Gordon C Marcin Gortat F Kelly Oubre Jr. G Andre Iguodala",NA,"","","",NA
2187,936899846,"GeneralAladeen (5/11)",0,219.75,"PF DeMarcus Cousins UTIL Spencer Dinwiddie F Tobias Harris SF Harrison Barnes C Steven Adams G J.J. Redick SG Wesley Matthews PG Michael Carter-Williams",NA,"","","",NA
2187,937358620,"jstone2424",0,219.75,"F Kevin Durant C Marc Gasol SG Jimmy Butler G Spencer Dinwiddie SF Otto Porter UTIL Stanley Johnson PG Ish Smith PF Bam Adebayo",NA,"","","",NA
2187,937376590,"Gregory2",0,219.75,"PF Kristaps Porzingis F LaMarcus Aldridge PG Kyle Lowry SG Tyreke Evans C Steven Adams UTIL Serge Ibaka G Wesley Matthews SF Danny Green",NA,"","","",NA
2190,937285704,"jjlangabeer (1/2)",0,219.5,"C Karl-Anthony Towns PG Chris Paul F Draymond Green SF Harrison Barnes UTIL Dennis Smith Jr. PF Dirk Nowitzki SG Bojan Bogdanovic G Wesley Matthews",NA,"","","",NA
2190,937354953,"machinistguy",0,219.5,"SG Devin Booker PG Spencer Dinwiddie SF Tobias Harris PF Robert Covington G Darren Collison UTIL Reggie Jackson F Jeremy Lamb C Marcin Gortat",NA,"","","",NA
2190,937390079,"GeneralAladeen (11/11)",0,219.5,"SG James Harden UTIL Otto Porter F Tobias Harris G Dennis Smith Jr. C Steven Adams PF Trevor Booker SF Bojan Bogdanovic PG Michael Carter-Williams",NA,"","","",NA
2190,937432945,"Shadow2317 (7/10)",0,219.5,"G James Harden C Andre Drummond PF Otto Porter SF Jeremy Lamb PG T.J. McConnell UTIL Tyus Jones SG Lance Stephenson F Patrick McCaw",NA,"","","",NA
2190,937432977,"Shadow2317 (8/10)",0,219.5,"G James Harden C Andre Drummond PF Otto Porter SF Jeremy Lamb PG T.J. McConnell UTIL Tyus Jones SG Lance Stephenson F Patrick McCaw",NA,"","","",NA
2190,937439404,"Shadow2317 (9/10)",0,219.5,"G James Harden C Andre Drummond PF Otto Porter SF Jeremy Lamb PG T.J. McConnell UTIL Tyus Jones SG Lance Stephenson F Patrick McCaw",NA,"","","",NA
2190,937439418,"Shadow2317 (10/10)",0,219.5,"G James Harden C Andre Drummond PF Otto Porter SF Jeremy Lamb PG T.J. McConnell UTIL Tyus Jones SG Lance Stephenson F Patrick McCaw",NA,"","","",NA
2197,937111544,"Fredvondog",0,219.25,"PG Russell Westbrook G Chris Paul SG Tyreke Evans SF J.J. Redick UTIL Eric Gordon F Serge Ibaka PF Kyle O'Quinn C Alex Len",NA,"","","",NA
2197,937245869,"scrotesquad69420",0,219.25,"C Andre Drummond F Kristaps Porzingis G Jrue Holiday SF Tim Hardaway Jr. PG Avery Bradley PF Ryan Anderson UTIL J.J. Barea SG Kelly Oubre Jr.",NA,"","","",NA
2197,937285122,"marvin.the.great (2/2)",0,219.25,"C Marc Gasol PG Chris Paul PF Carmelo Anthony SG Spencer Dinwiddie SF Dion Waiters G J.J. Barea F Caris LeVert UTIL Justise Winslow",NA,"","","",NA
2197,937297268,"thedocd (3/9)",0,219.25,"C Andre Drummond G Bradley Beal SF Tyreke Evans PF Tobias Harris F James Johnson SG Jeremy Lamb PG Michael Carter-Williams UTIL Bam Adebayo",NA,"","","",NA
2197,937303261,"thedocd (4/9)",0,219.25,"C Andre Drummond G Bradley Beal SF Tyreke Evans PF Tobias Harris F James Johnson SG Jeremy Lamb PG Michael Carter-Williams UTIL Bam Adebayo",NA,"","","",NA
